root@comp3134-winter-2022-intro-to-cyber-security:~# tcpdump -i eth0 tcp
tcpdump: verbose output suppressed, use -v or -vv for full protocol decode
listening on eth0, link-type EN10MB (Ethernet), capture size 262144 bytes
09:03:59.073704 IP comp3134-winter-2022-intro-to-cyber-security.ssh > cpe64777d6503a3-cm64777d6503a0.sdns.net.rogers.com.51538: Flags [P.], seq 2611254275:2611254383, ack 1409048134, win 501, options [nop,nop,TS val 3378381011 ecr 803750497], length 108
09:03:59.073791 IP comp3134-winter-2022-intro-to-cyber-security.ssh > cpe64777d6503a3-cm64777d6503a0.sdns.net.rogers.com.51538: Flags [P.], seq 108:144, ack 1, win 501, options [nop,nop,TS val 3378381011 ecr 803750497], length 36
09:03:59.073870 IP comp3134-winter-2022-intro-to-cyber-security.ssh > cpe64777d6503a3-cm64777d6503a0.sdns.net.rogers.com.51538: Flags [P.], seq 144:252, ack 1, win 501, options [nop,nop,TS val 3378381011 ecr 803750497], length 108
09:03:59.073939 IP comp3134-winter-2022-intro-to-cyber-security.ssh > cpe64777d6503a3-cm64777d6503a0.sdns.net.rogers.com.51538: Flags [P.], seq 252:288, ack 1, win 501, options [nop,nop,TS val 3378381011 ecr 803750497], length 36
09:03:59.080207 IP comp3134-winter-2022-intro-to-cyber-security.ssh > cpe64777d6503a3-cm64777d6503a0.sdns.net.rogers.com.51538: Flags [P.], seq 288:1276, ack 1, win 501, options [nop,nop,TS val 3378381017 ecr 803750497], length 988
09:03:59.080309 IP comp3134-winter-2022-intro-to-cyber-security.ssh > cpe64777d6503a3-cm64777d6503a0.sdns.net.rogers.com.51538: Flags [P.], seq 1276:1544, ack 1, win 501, options [nop,nop,TS val 3378381017 ecr 803750497], length 268
09:03:59.080392 IP comp3134-winter-2022-intro-to-cyber-security.ssh > cpe64777d6503a3-cm64777d6503a0.sdns.net.rogers.com.51538: Flags [P.], seq 1544:1812, ack 1, win 501, options [nop,nop,TS val 3378381017 ecr 803750497], length 268
09:03:59.080470 IP comp3134-winter-2022-intro-to-cyber-security.ssh > cpe64777d6503a3-cm64777d6503a0.sdns.net.rogers.com.51538: Flags [P.], seq 1812:2080, ack 1, win 501, options [nop,nop,TS val 3378381017 ecr 803750497], length 268
09:03:59.080557 IP comp3134-winter-2022-intro-to-cyber-security.ssh > cpe64777d6503a3-cm64777d6503a0.sdns.net.rogers.com.51538: Flags [P.], seq 2080:2348, ack 1, win 501, options [nop,nop,TS val 3378381017 ecr 803750497], length 268
09:03:59.089749 IP cpe64777d6503a3-cm64777d6503a0.sdns.net.rogers.com.51538 > comp3134-winter-2022-intro-to-cyber-security.ssh: Flags [.], ack 108, win 509, options [nop,nop,TS val 803750524 ecr 3378380999], length 0
09:03:59.089750 IP cpe64777d6503a3-cm64777d6503a0.sdns.net.rogers.com.51538 > comp3134-winter-2022-intro-to-cyber-security.ssh: Flags [.], ack 252, win 514, options [nop,nop,TS val 803750524 ecr 3378381011], length 0
09:03:59.089824 IP comp3134-winter-2022-intro-to-cyber-security.ssh > cpe64777d6503a3-cm64777d6503a0.sdns.net.rogers.com.51538: Flags [P.], seq 2348:2616, ack 1, win 501, options [nop,nop,TS val 3378381027 ecr 803750524], length 268
09:03:59.090087 IP comp3134-winter-2022-intro-to-cyber-security.ssh > cpe64777d6503a3-cm64777d6503a0.sdns.net.rogers.com.51538: Flags [P.], seq 2616:3324, ack 1, win 501, options [nop,nop,TS val 3378381027 ecr 803750524], length 708
09:03:59.090201 IP comp3134-winter-2022-intro-to-cyber-security.ssh > cpe64777d6503a3-cm64777d6503a0.sdns.net.rogers.com.51538: Flags [P.], seq 3324:3592, ack 1, win 501, options [nop,nop,TS val 3378381027 ecr 803750524], length 268
09:03:59.090302 IP comp3134-winter-2022-intro-to-cyber-security.ssh > cpe64777d6503a3-cm64777d6503a0.sdns.net.rogers.com.51538: Flags [P.], seq 3592:3860, ack 1, win 501, options [nop,nop,TS val 3378381027 ecr 803750524], length 268
09:03:59.090441 IP comp3134-winter-2022-intro-to-cyber-security.ssh > cpe64777d6503a3-cm64777d6503a0.sdns.net.rogers.com.51538: Flags [P.], seq 3860:4128, ack 1, win 501, options [nop,nop,TS val 3378381027 ecr 803750524], length 268
09:03:59.090542 IP comp3134-winter-2022-intro-to-cyber-security.ssh > cpe64777d6503a3-cm64777d6503a0.sdns.net.rogers.com.51538: Flags [P.], seq 4128:4396, ack 1, win 501, options [nop,nop,TS val 3378381027 ecr 803750524], length 268
09:03:59.090648 IP comp3134-winter-2022-intro-to-cyber-security.ssh > cpe64777d6503a3-cm64777d6503a0.sdns.net.rogers.com.51538: Flags [P.], seq 4396:4664, ack 1, win 501, options [nop,nop,TS val 3378381028 ecr 803750524], length 268
09:03:59.090750 IP comp3134-winter-2022-intro-to-cyber-security.ssh > cpe64777d6503a3-cm64777d6503a0.sdns.net.rogers.com.51538: Flags [P.], seq 4664:4932, ack 1, win 501, options [nop,nop,TS val 3378381028 ecr 803750524], length 268
09:03:59.094925 IP cpe64777d6503a3-cm64777d6503a0.sdns.net.rogers.com.51538 > comp3134-winter-2022-intro-to-cyber-security.ssh: Flags [.], ack 1276, win 510, options [nop,nop,TS val 803750531 ecr 3378381011], length 0
09:03:59.094925 IP cpe64777d6503a3-cm64777d6503a0.sdns.net.rogers.com.51538 > comp3134-winter-2022-intro-to-cyber-security.ssh: Flags [.], ack 1812, win 514, options [nop,nop,TS val 803750531 ecr 3378381017], length 0
09:03:59.094925 IP cpe64777d6503a3-cm64777d6503a0.sdns.net.rogers.com.51538 > comp3134-winter-2022-intro-to-cyber-security.ssh: Flags [.], ack 2348, win 512, options [nop,nop,TS val 803750531 ecr 3378381017], length 0
09:03:59.094968 IP comp3134-winter-2022-intro-to-cyber-security.ssh > cpe64777d6503a3-cm64777d6503a0.sdns.net.rogers.com.51538: Flags [P.], seq 4932:5200, ack 1, win 501, options [nop,nop,TS val 3378381032 ecr 803750531], length 268
09:03:59.095116 IP comp3134-winter-2022-intro-to-cyber-security.ssh > cpe64777d6503a3-cm64777d6503a0.sdns.net.rogers.com.51538: Flags [P.], seq 5200:5452, ack 1, win 501, options [nop,nop,TS val 3378381032 ecr 803750531], length 252
09:03:59.095190 IP comp3134-winter-2022-intro-to-cyber-security.ssh > cpe64777d6503a3-cm64777d6503a0.sdns.net.rogers.com.51538: Flags [P.], seq 5452:5488, ack 1, win 501, options [nop,nop,TS val 3378381032 ecr 803750531], length 36
09:03:59.095280 IP comp3134-winter-2022-intro-to-cyber-security.ssh > cpe64777d6503a3-cm64777d6503a0.sdns.net.rogers.com.51538: Flags [P.], seq 5488:5740, ack 1, win 501, options [nop,nop,TS val 3378381032 ecr 803750531], length 252
09:03:59.095351 IP comp3134-winter-2022-intro-to-cyber-security.ssh > cpe64777d6503a3-cm64777d6503a0.sdns.net.rogers.com.51538: Flags [P.], seq 5740:5776, ack 1, win 501, options [nop,nop,TS val 3378381032 ecr 803750531], length 36
09:03:59.095428 IP comp3134-winter-2022-intro-to-cyber-security.ssh > cpe64777d6503a3-cm64777d6503a0.sdns.net.rogers.com.51538: Flags [P.], seq 5776:6028, ack 1, win 501, options [nop,nop,TS val 3378381032 ecr 803750531], length 252
09:03:59.095497 IP comp3134-winter-2022-intro-to-cyber-security.ssh > cpe64777d6503a3-cm64777d6503a0.sdns.net.rogers.com.51538: Flags [P.], seq 6028:6064, ack 1, win 501, options [nop,nop,TS val 3378381032 ecr 803750531], length 36
09:03:59.095584 IP comp3134-winter-2022-intro-to-cyber-security.ssh > cpe64777d6503a3-cm64777d6503a0.sdns.net.rogers.com.51538: Flags [P.], seq 6064:6332, ack 1, win 501, options [nop,nop,TS val 3378381033 ecr 803750531], length 268
09:03:59.095651 IP comp3134-winter-2022-intro-to-cyber-security.ssh > cpe64777d6503a3-cm64777d6503a0.sdns.net.rogers.com.51538: Flags [P.], seq 6332:6368, ack 1, win 501, options [nop,nop,TS val 3378381033 ecr 803750531], length 36
09:03:59.095756 IP comp3134-winter-2022-intro-to-cyber-security.ssh > cpe64777d6503a3-cm64777d6503a0.sdns.net.rogers.com.51538: Flags [P.], seq 6368:6636, ack 1, win 501, options [nop,nop,TS val 3378381033 ecr 803750531], length 268
09:03:59.095823 IP comp3134-winter-2022-intro-to-cyber-security.ssh > cpe64777d6503a3-cm64777d6503a0.sdns.net.rogers.com.51538: Flags [P.], seq 6636:6672, ack 1, win 501, options [nop,nop,TS val 3378381033 ecr 803750531], length 36
09:03:59.095911 IP comp3134-winter-2022-intro-to-cyber-security.ssh > cpe64777d6503a3-cm64777d6503a0.sdns.net.rogers.com.51538: Flags [P.], seq 6672:6940, ack 1, win 501, options [nop,nop,TS val 3378381033 ecr 803750531], length 268
09:03:59.104784 IP cpe64777d6503a3-cm64777d6503a0.sdns.net.rogers.com.51538 > comp3134-winter-2022-intro-to-cyber-security.ssh: Flags [.], ack 3324, win 514, options [nop,nop,TS val 803750540 ecr 3378381027], length 0
09:03:59.104785 IP cpe64777d6503a3-cm64777d6503a0.sdns.net.rogers.com.51538 > comp3134-winter-2022-intro-to-cyber-security.ssh: Flags [.], ack 4932, win 514, options [nop,nop,TS val 803750541 ecr 3378381028], length 0
09:03:59.104872 IP comp3134-winter-2022-intro-to-cyber-security.ssh > cpe64777d6503a3-cm64777d6503a0.sdns.net.rogers.com.51538: Flags [P.], seq 6940:9712, ack 1, win 501, options [nop,nop,TS val 3378381042 ecr 803750540], length 2772
09:03:59.105098 IP comp3134-winter-2022-intro-to-cyber-security.ssh > cpe64777d6503a3-cm64777d6503a0.sdns.net.rogers.com.51538: Flags [P.], seq 9712:9964, ack 1, win 501, options [nop,nop,TS val 3378381042 ecr 803750541], length 252
09:03:59.105191 IP comp3134-winter-2022-intro-to-cyber-security.ssh > cpe64777d6503a3-cm64777d6503a0.sdns.net.rogers.com.51538: Flags [P.], seq 9964:10000, ack 1, win 501, options [nop,nop,TS val 3378381042 ecr 803750541], length 36
09:03:59.105307 IP comp3134-winter-2022-intro-to-cyber-security.ssh > cpe64777d6503a3-cm64777d6503a0.sdns.net.rogers.com.51538: Flags [P.], seq 10000:10252, ack 1, win 501, options [nop,nop,TS val 3378381042 ecr 803750541], length 252
09:03:59.105382 IP comp3134-winter-2022-intro-to-cyber-security.ssh > cpe64777d6503a3-cm64777d6503a0.sdns.net.rogers.com.51538: Flags [P.], seq 10252:10288, ack 1, win 501, options [nop,nop,TS val 3378381042 ecr 803750541], length 36
09:03:59.105475 IP comp3134-winter-2022-intro-to-cyber-security.ssh > cpe64777d6503a3-cm64777d6503a0.sdns.net.rogers.com.51538: Flags [P.], seq 10288:10556, ack 1, win 501, options [nop,nop,TS val 3378381042 ecr 803750541], length 268
09:03:59.105551 IP comp3134-winter-2022-intro-to-cyber-security.ssh > cpe64777d6503a3-cm64777d6503a0.sdns.net.rogers.com.51538: Flags [P.], seq 10556:10592, ack 1, win 501, options [nop,nop,TS val 3378381042 ecr 803750541], length 36
09:03:59.105646 IP comp3134-winter-2022-intro-to-cyber-security.ssh > cpe64777d6503a3-cm64777d6503a0.sdns.net.rogers.com.51538: Flags [P.], seq 10592:10860, ack 1, win 501, options [nop,nop,TS val 3378381043 ecr 803750541], length 268
09:03:59.105720 IP comp3134-winter-2022-intro-to-cyber-security.ssh > cpe64777d6503a3-cm64777d6503a0.sdns.net.rogers.com.51538: Flags [P.], seq 10860:10896, ack 1, win 501, options [nop,nop,TS val 3378381043 ecr 803750541], length 36
09:03:59.105805 IP comp3134-winter-2022-intro-to-cyber-security.ssh > cpe64777d6503a3-cm64777d6503a0.sdns.net.rogers.com.51538: Flags [P.], seq 10896:11164, ack 1, win 501, options [nop,nop,TS val 3378381043 ecr 803750541], length 268
09:03:59.105873 IP comp3134-winter-2022-intro-to-cyber-security.ssh > cpe64777d6503a3-cm64777d6503a0.sdns.net.rogers.com.51538: Flags [P.], seq 11164:11200, ack 1, win 501, options [nop,nop,TS val 3378381043 ecr 803750541], length 36
09:03:59.105959 IP comp3134-winter-2022-intro-to-cyber-security.ssh > cpe64777d6503a3-cm64777d6503a0.sdns.net.rogers.com.51538: Flags [P.], seq 11200:11468, ack 1, win 501, options [nop,nop,TS val 3378381043 ecr 803750541], length 268
09:03:59.106028 IP comp3134-winter-2022-intro-to-cyber-security.ssh > cpe64777d6503a3-cm64777d6503a0.sdns.net.rogers.com.51538: Flags [P.], seq 11468:11504, ack 1, win 501, options [nop,nop,TS val 3378381043 ecr 803750541], length 36
09:03:59.106121 IP comp3134-winter-2022-intro-to-cyber-security.ssh > cpe64777d6503a3-cm64777d6503a0.sdns.net.rogers.com.51538: Flags [P.], seq 11504:11772, ack 1, win 501, options [nop,nop,TS val 3378381043 ecr 803750541], length 268
09:03:59.106190 IP comp3134-winter-2022-intro-to-cyber-security.ssh > cpe64777d6503a3-cm64777d6503a0.sdns.net.rogers.com.51538: Flags [P.], seq 11772:11808, ack 1, win 501, options [nop,nop,TS val 3378381043 ecr 803750541], length 36
09:03:59.111163 IP cpe64777d6503a3-cm64777d6503a0.sdns.net.rogers.com.51538 > comp3134-winter-2022-intro-to-cyber-security.ssh: Flags [.], ack 5452, win 512, options [nop,nop,TS val 803750544 ecr 3378381032], length 0
09:03:59.111164 IP cpe64777d6503a3-cm64777d6503a0.sdns.net.rogers.com.51538 > comp3134-winter-2022-intro-to-cyber-security.ssh: Flags [.], ack 5740, win 511, options [nop,nop,TS val 803750544 ecr 3378381032], length 0
09:03:59.111164 IP cpe64777d6503a3-cm64777d6503a0.sdns.net.rogers.com.51538 > comp3134-winter-2022-intro-to-cyber-security.ssh: Flags [.], ack 6028, win 510, options [nop,nop,TS val 803750544 ecr 3378381032], length 0
09:03:59.111164 IP cpe64777d6503a3-cm64777d6503a0.sdns.net.rogers.com.51538 > comp3134-winter-2022-intro-to-cyber-security.ssh: Flags [.], ack 6332, win 509, options [nop,nop,TS val 803750544 ecr 3378381032], length 0
09:03:59.111164 IP cpe64777d6503a3-cm64777d6503a0.sdns.net.rogers.com.51538 > comp3134-winter-2022-intro-to-cyber-security.ssh: Flags [.], ack 6636, win 514, options [nop,nop,TS val 803750544 ecr 3378381033], length 0
09:03:59.111164 IP cpe64777d6503a3-cm64777d6503a0.sdns.net.rogers.com.51538 > comp3134-winter-2022-intro-to-cyber-security.ssh: Flags [.], ack 6940, win 513, options [nop,nop,TS val 803750544 ecr 3378381033], length 0
09:03:59.111233 IP comp3134-winter-2022-intro-to-cyber-security.ssh > cpe64777d6503a3-cm64777d6503a0.sdns.net.rogers.com.51538: Flags [P.], seq 11808:14704, ack 1, win 501, options [nop,nop,TS val 3378381048 ecr 803750544], length 2896
09:03:59.111279 IP comp3134-winter-2022-intro-to-cyber-security.ssh > cpe64777d6503a3-cm64777d6503a0.sdns.net.rogers.com.51538: Flags [P.], seq 14704:14848, ack 1, win 501, options [nop,nop,TS val 3378381048 ecr 803750544], length 144
09:03:59.111428 IP comp3134-winter-2022-intro-to-cyber-security.ssh > cpe64777d6503a3-cm64777d6503a0.sdns.net.rogers.com.51538: Flags [P.], seq 14848:15100, ack 1, win 501, options [nop,nop,TS val 3378381048 ecr 803750544], length 252
09:03:59.111508 IP comp3134-winter-2022-intro-to-cyber-security.ssh > cpe64777d6503a3-cm64777d6503a0.sdns.net.rogers.com.51538: Flags [P.], seq 15100:15136, ack 1, win 501, options [nop,nop,TS val 3378381048 ecr 803750544], length 36
09:03:59.111599 IP comp3134-winter-2022-intro-to-cyber-security.ssh > cpe64777d6503a3-cm64777d6503a0.sdns.net.rogers.com.51538: Flags [P.], seq 15136:15388, ack 1, win 501, options [nop,nop,TS val 3378381049 ecr 803750544], length 252
09:03:59.111692 IP comp3134-winter-2022-intro-to-cyber-security.ssh > cpe64777d6503a3-cm64777d6503a0.sdns.net.rogers.com.51538: Flags [P.], seq 15388:15424, ack 1, win 501, options [nop,nop,TS val 3378381049 ecr 803750544], length 36
09:03:59.111747 IP comp3134-winter-2022-intro-to-cyber-security.ssh > cpe64777d6503a3-cm64777d6503a0.sdns.net.rogers.com.51538: Flags [P.], seq 15424:15676, ack 1, win 501, options [nop,nop,TS val 3378381049 ecr 803750544], length 252
09:03:59.111798 IP comp3134-winter-2022-intro-to-cyber-security.ssh > cpe64777d6503a3-cm64777d6503a0.sdns.net.rogers.com.51538: Flags [P.], seq 15676:15712, ack 1, win 501, options [nop,nop,TS val 3378381049 ecr 803750544], length 36
09:03:59.111879 IP comp3134-winter-2022-intro-to-cyber-security.ssh > cpe64777d6503a3-cm64777d6503a0.sdns.net.rogers.com.51538: Flags [P.], seq 15712:15964, ack 1, win 501, options [nop,nop,TS val 3378381049 ecr 803750544], length 252
09:03:59.111965 IP comp3134-winter-2022-intro-to-cyber-security.ssh > cpe64777d6503a3-cm64777d6503a0.sdns.net.rogers.com.51538: Flags [P.], seq 15964:16000, ack 1, win 501, options [nop,nop,TS val 3378381049 ecr 803750544], length 36
09:03:59.112053 IP comp3134-winter-2022-intro-to-cyber-security.ssh > cpe64777d6503a3-cm64777d6503a0.sdns.net.rogers.com.51538: Flags [P.], seq 16000:16252, ack 1, win 501, options [nop,nop,TS val 3378381049 ecr 803750544], length 252
09:03:59.112123 IP comp3134-winter-2022-intro-to-cyber-security.ssh > cpe64777d6503a3-cm64777d6503a0.sdns.net.rogers.com.51538: Flags [P.], seq 16252:16288, ack 1, win 501, options [nop,nop,TS val 3378381049 ecr 803750544], length 36
09:03:59.112217 IP comp3134-winter-2022-intro-to-cyber-security.ssh > cpe64777d6503a3-cm64777d6503a0.sdns.net.rogers.com.51538: Flags [P.], seq 16288:16540, ack 1, win 501, options [nop,nop,TS val 3378381049 ecr 803750544], length 252
09:03:59.112286 IP comp3134-winter-2022-intro-to-cyber-security.ssh > cpe64777d6503a3-cm64777d6503a0.sdns.net.rogers.com.51538: Flags [P.], seq 16540:16576, ack 1, win 501, options [nop,nop,TS val 3378381049 ecr 803750544], length 36
09:03:59.112386 IP comp3134-winter-2022-intro-to-cyber-security.ssh > cpe64777d6503a3-cm64777d6503a0.sdns.net.rogers.com.51538: Flags [P.], seq 16576:16852, ack 1, win 501, options [nop,nop,TS val 3378381049 ecr 803750544], length 276
09:03:59.112452 IP comp3134-winter-2022-intro-to-cyber-security.ssh > cpe64777d6503a3-cm64777d6503a0.sdns.net.rogers.com.51538: Flags [P.], seq 16852:16888, ack 1, win 501, options [nop,nop,TS val 3378381049 ecr 803750544], length 36
09:03:59.112511 IP comp3134-winter-2022-intro-to-cyber-security.ssh > cpe64777d6503a3-cm64777d6503a0.sdns.net.rogers.com.51538: Flags [P.], seq 16888:17156, ack 1, win 501, options [nop,nop,TS val 3378381049 ecr 803750544], length 268
09:03:59.112570 IP comp3134-winter-2022-intro-to-cyber-security.ssh > cpe64777d6503a3-cm64777d6503a0.sdns.net.rogers.com.51538: Flags [P.], seq 17156:17192, ack 1, win 501, options [nop,nop,TS val 3378381049 ecr 803750544], length 36
09:03:59.112639 IP comp3134-winter-2022-intro-to-cyber-security.ssh > cpe64777d6503a3-cm64777d6503a0.sdns.net.rogers.com.51538: Flags [P.], seq 17192:17460, ack 1, win 501, options [nop,nop,TS val 3378381050 ecr 803750544], length 268
09:03:59.112706 IP comp3134-winter-2022-intro-to-cyber-security.ssh > cpe64777d6503a3-cm64777d6503a0.sdns.net.rogers.com.51538: Flags [P.], seq 17460:17496, ack 1, win 501, options [nop,nop,TS val 3378381050 ecr 803750544], length 36
09:03:59.112799 IP comp3134-winter-2022-intro-to-cyber-security.ssh > cpe64777d6503a3-cm64777d6503a0.sdns.net.rogers.com.51538: Flags [P.], seq 17496:17764, ack 1, win 501, options [nop,nop,TS val 3378381050 ecr 803750544], length 268
09:03:59.112869 IP comp3134-winter-2022-intro-to-cyber-security.ssh > cpe64777d6503a3-cm64777d6503a0.sdns.net.rogers.com.51538: Flags [P.], seq 17764:17800, ack 1, win 501, options [nop,nop,TS val 3378381050 ecr 803750544], length 36
09:03:59.119773 IP cpe64777d6503a3-cm64777d6503a0.sdns.net.rogers.com.51538 > comp3134-winter-2022-intro-to-cyber-security.ssh: Flags [.], ack 9712, win 514, options [nop,nop,TS val 803750554 ecr 3378381042], length 0
09:03:59.119773 IP cpe64777d6503a3-cm64777d6503a0.sdns.net.rogers.com.51538 > comp3134-winter-2022-intro-to-cyber-security.ssh: Flags [.], ack 10000, win 513, options [nop,nop,TS val 803750555 ecr 3378381042], length 0
09:03:59.119774 IP cpe64777d6503a3-cm64777d6503a0.sdns.net.rogers.com.51538 > comp3134-winter-2022-intro-to-cyber-security.ssh: Flags [.], ack 10288, win 512, options [nop,nop,TS val 803750555 ecr 3378381042], length 0
09:03:59.119774 IP cpe64777d6503a3-cm64777d6503a0.sdns.net.rogers.com.51538 > comp3134-winter-2022-intro-to-cyber-security.ssh: Flags [.], ack 10592, win 511, options [nop,nop,TS val 803750555 ecr 3378381042], length 0
09:03:59.119774 IP cpe64777d6503a3-cm64777d6503a0.sdns.net.rogers.com.51538 > comp3134-winter-2022-intro-to-cyber-security.ssh: Flags [.], ack 10896, win 510, options [nop,nop,TS val 803750555 ecr 3378381043], length 0
09:03:59.119774 IP cpe64777d6503a3-cm64777d6503a0.sdns.net.rogers.com.51538 > comp3134-winter-2022-intro-to-cyber-security.ssh: Flags [.], ack 11200, win 514, options [nop,nop,TS val 803750555 ecr 3378381043], length 0
09:03:59.119974 IP comp3134-winter-2022-intro-to-cyber-security.ssh > cpe64777d6503a3-cm64777d6503a0.sdns.net.rogers.com.51538: Flags [P.], seq 17800:23272, ack 1, win 501, options [nop,nop,TS val 3378381057 ecr 803750555], length 5472
09:03:59.120148 IP comp3134-winter-2022-intro-to-cyber-security.ssh > cpe64777d6503a3-cm64777d6503a0.sdns.net.rogers.com.51538: Flags [P.], seq 23272:23524, ack 1, win 501, options [nop,nop,TS val 3378381057 ecr 803750555], length 252
09:03:59.120232 IP comp3134-winter-2022-intro-to-cyber-security.ssh > cpe64777d6503a3-cm64777d6503a0.sdns.net.rogers.com.51538: Flags [P.], seq 23524:23560, ack 1, win 501, options [nop,nop,TS val 3378381057 ecr 803750555], length 36
09:03:59.120332 IP comp3134-winter-2022-intro-to-cyber-security.ssh > cpe64777d6503a3-cm64777d6503a0.sdns.net.rogers.com.51538: Flags [P.], seq 23560:23812, ack 1, win 501, options [nop,nop,TS val 3378381057 ecr 803750555], length 252
09:03:59.120406 IP comp3134-winter-2022-intro-to-cyber-security.ssh > cpe64777d6503a3-cm64777d6503a0.sdns.net.rogers.com.51538: Flags [P.], seq 23812:23848, ack 1, win 501, options [nop,nop,TS val 3378381057 ecr 803750555], length 36
09:03:59.120497 IP comp3134-winter-2022-intro-to-cyber-security.ssh > cpe64777d6503a3-cm64777d6503a0.sdns.net.rogers.com.51538: Flags [P.], seq 23848:24100, ack 1, win 501, options [nop,nop,TS val 3378381057 ecr 803750555], length 252
09:03:59.120567 IP comp3134-winter-2022-intro-to-cyber-security.ssh > cpe64777d6503a3-cm64777d6503a0.sdns.net.rogers.com.51538: Flags [P.], seq 24100:24136, ack 1, win 501, options [nop,nop,TS val 3378381057 ecr 803750555], length 36
09:03:59.120666 IP comp3134-winter-2022-intro-to-cyber-security.ssh > cpe64777d6503a3-cm64777d6503a0.sdns.net.rogers.com.51538: Flags [P.], seq 24136:24388, ack 1, win 501, options [nop,nop,TS val 3378381058 ecr 803750555], length 252
09:03:59.120744 IP comp3134-winter-2022-intro-to-cyber-security.ssh > cpe64777d6503a3-cm64777d6503a0.sdns.net.rogers.com.51538: Flags [P.], seq 24388:24424, ack 1, win 501, options [nop,nop,TS val 3378381058 ecr 803750555], length 36
09:03:59.120840 IP comp3134-winter-2022-intro-to-cyber-security.ssh > cpe64777d6503a3-cm64777d6503a0.sdns.net.rogers.com.51538: Flags [P.], seq 24424:24676, ack 1, win 501, options [nop,nop,TS val 3378381058 ecr 803750555], length 252
09:03:59.120914 IP comp3134-winter-2022-intro-to-cyber-security.ssh > cpe64777d6503a3-cm64777d6503a0.sdns.net.rogers.com.51538: Flags [P.], seq 24676:24712, ack 1, win 501, options [nop,nop,TS val 3378381058 ecr 803750555], length 36
09:03:59.121017 IP comp3134-winter-2022-intro-to-cyber-security.ssh > cpe64777d6503a3-cm64777d6503a0.sdns.net.rogers.com.51538: Flags [P.], seq 24712:24964, ack 1, win 501, options [nop,nop,TS val 3378381058 ecr 803750555], length 252
09:03:59.121096 IP comp3134-winter-2022-intro-to-cyber-security.ssh > cpe64777d6503a3-cm64777d6503a0.sdns.net.rogers.com.51538: Flags [P.], seq 24964:25000, ack 1, win 501, options [nop,nop,TS val 3378381058 ecr 803750555], length 36
09:03:59.121189 IP comp3134-winter-2022-intro-to-cyber-security.ssh > cpe64777d6503a3-cm64777d6503a0.sdns.net.rogers.com.51538: Flags [P.], seq 25000:25276, ack 1, win 501, options [nop,nop,TS val 3378381058 ecr 803750555], length 276
09:03:59.121337 IP comp3134-winter-2022-intro-to-cyber-security.ssh > cpe64777d6503a3-cm64777d6503a0.sdns.net.rogers.com.51538: Flags [P.], seq 25276:27200, ack 1, win 501, options [nop,nop,TS val 3378381058 ecr 803750555], length 1924
09:03:59.121456 IP comp3134-winter-2022-intro-to-cyber-security.ssh > cpe64777d6503a3-cm64777d6503a0.sdns.net.rogers.com.51538: Flags [P.], seq 27200:28652, ack 1, win 501, options [nop,nop,TS val 3378381058 ecr 803750555], length 1452
09:03:59.121529 IP comp3134-winter-2022-intro-to-cyber-security.ssh > cpe64777d6503a3-cm64777d6503a0.sdns.net.rogers.com.51538: Flags [P.], seq 28652:28928, ack 1, win 501, options [nop,nop,TS val 3378381058 ecr 803750555], length 276
09:03:59.121595 IP comp3134-winter-2022-intro-to-cyber-security.ssh > cpe64777d6503a3-cm64777d6503a0.sdns.net.rogers.com.51538: Flags [P.], seq 28928:29204, ack 1, win 501, options [nop,nop,TS val 3378381059 ecr 803750555], length 276
09:03:59.121669 IP comp3134-winter-2022-intro-to-cyber-security.ssh > cpe64777d6503a3-cm64777d6503a0.sdns.net.rogers.com.51538: Flags [P.], seq 29204:29480, ack 1, win 501, options [nop,nop,TS val 3378381059 ecr 803750555], length 276
09:03:59.121731 IP comp3134-winter-2022-intro-to-cyber-security.ssh > cpe64777d6503a3-cm64777d6503a0.sdns.net.rogers.com.51538: Flags [P.], seq 29480:29756, ack 1, win 501, options [nop,nop,TS val 3378381059 ecr 803750555], length 276
09:03:59.127162 IP cpe64777d6503a3-cm64777d6503a0.sdns.net.rogers.com.51538 > comp3134-winter-2022-intro-to-cyber-security.ssh: Flags [.], ack 11504, win 513, options [nop,nop,TS val 803750557 ecr 3378381043], length 0
09:03:59.127162 IP cpe64777d6503a3-cm64777d6503a0.sdns.net.rogers.com.51538 > comp3134-winter-2022-intro-to-cyber-security.ssh: Flags [.], ack 11808, win 512, options [nop,nop,TS val 803750558 ecr 3378381043], length 0
09:03:59.127213 IP comp3134-winter-2022-intro-to-cyber-security.ssh > cpe64777d6503a3-cm64777d6503a0.sdns.net.rogers.com.51538: Flags [P.], seq 29756:30032, ack 1, win 501, options [nop,nop,TS val 3378381064 ecr 803750557], length 276
09:03:59.127352 IP comp3134-winter-2022-intro-to-cyber-security.ssh > cpe64777d6503a3-cm64777d6503a0.sdns.net.rogers.com.51538: Flags [P.], seq 30032:30284, ack 1, win 501, options [nop,nop,TS val 3378381064 ecr 803750558], length 252
09:03:59.127507 IP comp3134-winter-2022-intro-to-cyber-security.ssh > cpe64777d6503a3-cm64777d6503a0.sdns.net.rogers.com.51538: Flags [P.], seq 30284:31016, ack 1, win 501, options [nop,nop,TS val 3378381064 ecr 803750558], length 732
09:03:59.127637 IP comp3134-winter-2022-intro-to-cyber-security.ssh > cpe64777d6503a3-cm64777d6503a0.sdns.net.rogers.com.51538: Flags [P.], seq 31016:31292, ack 1, win 501, options [nop,nop,TS val 3378381065 ecr 803750558], length 276
09:03:59.127759 IP comp3134-winter-2022-intro-to-cyber-security.ssh > cpe64777d6503a3-cm64777d6503a0.sdns.net.rogers.com.51538: Flags [P.], seq 31292:31568, ack 1, win 501, options [nop,nop,TS val 3378381065 ecr 803750558], length 276
09:03:59.127871 IP comp3134-winter-2022-intro-to-cyber-security.ssh > cpe64777d6503a3-cm64777d6503a0.sdns.net.rogers.com.51538: Flags [P.], seq 31568:31844, ack 1, win 501, options [nop,nop,TS val 3378381065 ecr 803750558], length 276
09:03:59.127967 IP comp3134-winter-2022-intro-to-cyber-security.ssh > cpe64777d6503a3-cm64777d6503a0.sdns.net.rogers.com.51538: Flags [P.], seq 31844:32120, ack 1, win 501, options [nop,nop,TS val 3378381065 ecr 803750558], length 276
09:03:59.128074 IP comp3134-winter-2022-intro-to-cyber-security.ssh > cpe64777d6503a3-cm64777d6503a0.sdns.net.rogers.com.51538: Flags [P.], seq 32120:32396, ack 1, win 501, options [nop,nop,TS val 3378381065 ecr 803750558], length 276
09:03:59.135018 IP cpe64777d6503a3-cm64777d6503a0.sdns.net.rogers.com.51538 > comp3134-winter-2022-intro-to-cyber-security.ssh: Flags [.], ack 14704, win 514, options [nop,nop,TS val 803750563 ecr 3378381048], length 0
09:03:59.135019 IP cpe64777d6503a3-cm64777d6503a0.sdns.net.rogers.com.51538 > comp3134-winter-2022-intro-to-cyber-security.ssh: Flags [.], ack 15100, win 513, options [nop,nop,TS val 803750563 ecr 3378381048], length 0
09:03:59.135019 IP cpe64777d6503a3-cm64777d6503a0.sdns.net.rogers.com.51538 > comp3134-winter-2022-intro-to-cyber-security.ssh: Flags [.], ack 15388, win 512, options [nop,nop,TS val 803750563 ecr 3378381048], length 0
09:03:59.135019 IP cpe64777d6503a3-cm64777d6503a0.sdns.net.rogers.com.51538 > comp3134-winter-2022-intro-to-cyber-security.ssh: Flags [.], ack 15676, win 510, options [nop,nop,TS val 803750563 ecr 3378381049], length 0
09:03:59.135019 IP cpe64777d6503a3-cm64777d6503a0.sdns.net.rogers.com.51538 > comp3134-winter-2022-intro-to-cyber-security.ssh: Flags [.], ack 15964, win 509, options [nop,nop,TS val 803750563 ecr 3378381049], length 0
09:03:59.135019 IP cpe64777d6503a3-cm64777d6503a0.sdns.net.rogers.com.51538 > comp3134-winter-2022-intro-to-cyber-security.ssh: Flags [.], ack 16252, win 514, options [nop,nop,TS val 803750563 ecr 3378381049], length 0
09:03:59.135019 IP cpe64777d6503a3-cm64777d6503a0.sdns.net.rogers.com.51538 > comp3134-winter-2022-intro-to-cyber-security.ssh: Flags [.], ack 16540, win 513, options [nop,nop,TS val 803750564 ecr 3378381049], length 0
09:03:59.135019 IP cpe64777d6503a3-cm64777d6503a0.sdns.net.rogers.com.51538 > comp3134-winter-2022-intro-to-cyber-security.ssh: Flags [.], ack 16852, win 512, options [nop,nop,TS val 803750564 ecr 3378381049], length 0
09:03:59.135098 IP comp3134-winter-2022-intro-to-cyber-security.ssh > cpe64777d6503a3-cm64777d6503a0.sdns.net.rogers.com.51538: Flags [P.], seq 32396:32672, ack 1, win 501, options [nop,nop,TS val 3378381072 ecr 803750563], length 276
09:03:59.135186 IP cpe64777d6503a3-cm64777d6503a0.sdns.net.rogers.com.51538 > comp3134-winter-2022-intro-to-cyber-security.ssh: Flags [.], ack 17156, win 511, options [nop,nop,TS val 803750564 ecr 3378381049], length 0
09:03:59.135186 IP cpe64777d6503a3-cm64777d6503a0.sdns.net.rogers.com.51538 > comp3134-winter-2022-intro-to-cyber-security.ssh: Flags [.], ack 17460, win 510, options [nop,nop,TS val 803750564 ecr 3378381049], length 0
09:03:59.135186 IP cpe64777d6503a3-cm64777d6503a0.sdns.net.rogers.com.51538 > comp3134-winter-2022-intro-to-cyber-security.ssh: Flags [.], ack 17764, win 514, options [nop,nop,TS val 803750564 ecr 3378381050], length 0
09:03:59.135638 IP comp3134-winter-2022-intro-to-cyber-security.ssh > cpe64777d6503a3-cm64777d6503a0.sdns.net.rogers.com.51538: Flags [P.], seq 32672:35364, ack 1, win 501, options [nop,nop,TS val 3378381073 ecr 803750564], length 2692
09:03:59.135759 IP comp3134-winter-2022-intro-to-cyber-security.ssh > cpe64777d6503a3-cm64777d6503a0.sdns.net.rogers.com.51538: Flags [P.], seq 35364:35640, ack 1, win 501, options [nop,nop,TS val 3378381073 ecr 803750564], length 276
09:03:59.135858 IP comp3134-winter-2022-intro-to-cyber-security.ssh > cpe64777d6503a3-cm64777d6503a0.sdns.net.rogers.com.51538: Flags [P.], seq 35640:35916, ack 1, win 501, options [nop,nop,TS val 3378381073 ecr 803750564], length 276
09:03:59.135982 IP comp3134-winter-2022-intro-to-cyber-security.ssh > cpe64777d6503a3-cm64777d6503a0.sdns.net.rogers.com.51538: Flags [P.], seq 35916:36192, ack 1, win 501, options [nop,nop,TS val 3378381073 ecr 803750564], length 276
09:03:59.136097 IP comp3134-winter-2022-intro-to-cyber-security.ssh > cpe64777d6503a3-cm64777d6503a0.sdns.net.rogers.com.51538: Flags [P.], seq 36192:36468, ack 1, win 501, options [nop,nop,TS val 3378381073 ecr 803750564], length 276
09:03:59.136188 IP comp3134-winter-2022-intro-to-cyber-security.ssh > cpe64777d6503a3-cm64777d6503a0.sdns.net.rogers.com.51538: Flags [P.], seq 36468:36744, ack 1, win 501, options [nop,nop,TS val 3378381073 ecr 803750564], length 276
09:03:59.136289 IP comp3134-winter-2022-intro-to-cyber-security.ssh > cpe64777d6503a3-cm64777d6503a0.sdns.net.rogers.com.51538: Flags [P.], seq 36744:37020, ack 1, win 501, options [nop,nop,TS val 3378381073 ecr 803750564], length 276
09:03:59.136373 IP comp3134-winter-2022-intro-to-cyber-security.ssh > cpe64777d6503a3-cm64777d6503a0.sdns.net.rogers.com.51538: Flags [P.], seq 37020:37296, ack 1, win 501, options [nop,nop,TS val 3378381073 ecr 803750564], length 276
09:03:59.136458 IP comp3134-winter-2022-intro-to-cyber-security.ssh > cpe64777d6503a3-cm64777d6503a0.sdns.net.rogers.com.51538: Flags [P.], seq 37296:37572, ack 1, win 501, options [nop,nop,TS val 3378381073 ecr 803750564], length 276
09:03:59.136558 IP comp3134-winter-2022-intro-to-cyber-security.ssh > cpe64777d6503a3-cm64777d6503a0.sdns.net.rogers.com.51538: Flags [P.], seq 37572:37848, ack 1, win 501, options [nop,nop,TS val 3378381073 ecr 803750564], length 276
09:03:59.136676 IP comp3134-winter-2022-intro-to-cyber-security.ssh > cpe64777d6503a3-cm64777d6503a0.sdns.net.rogers.com.51538: Flags [P.], seq 37848:38124, ack 1, win 501, options [nop,nop,TS val 3378381074 ecr 803750564], length 276
09:03:59.136759 IP comp3134-winter-2022-intro-to-cyber-security.ssh > cpe64777d6503a3-cm64777d6503a0.sdns.net.rogers.com.51538: Flags [P.], seq 38124:38400, ack 1, win 501, options [nop,nop,TS val 3378381074 ecr 803750564], length 276
09:03:59.136847 IP comp3134-winter-2022-intro-to-cyber-security.ssh > cpe64777d6503a3-cm64777d6503a0.sdns.net.rogers.com.51538: Flags [P.], seq 38400:38676, ack 1, win 501, options [nop,nop,TS val 3378381074 ecr 803750564], length 276
09:03:59.136932 IP comp3134-winter-2022-intro-to-cyber-security.ssh > cpe64777d6503a3-cm64777d6503a0.sdns.net.rogers.com.51538: Flags [P.], seq 38676:38952, ack 1, win 501, options [nop,nop,TS val 3378381074 ecr 803750564], length 276
09:03:59.137015 IP comp3134-winter-2022-intro-to-cyber-security.ssh > cpe64777d6503a3-cm64777d6503a0.sdns.net.rogers.com.51538: Flags [P.], seq 38952:39228, ack 1, win 501, options [nop,nop,TS val 3378381074 ecr 803750564], length 276
09:03:59.137105 IP comp3134-winter-2022-intro-to-cyber-security.ssh > cpe64777d6503a3-cm64777d6503a0.sdns.net.rogers.com.51538: Flags [P.], seq 39228:39504, ack 1, win 501, options [nop,nop,TS val 3378381074 ecr 803750564], length 276
09:03:59.137194 IP comp3134-winter-2022-intro-to-cyber-security.ssh > cpe64777d6503a3-cm64777d6503a0.sdns.net.rogers.com.51538: Flags [P.], seq 39504:39780, ack 1, win 501, options [nop,nop,TS val 3378381074 ecr 803750564], length 276
09:03:59.137281 IP comp3134-winter-2022-intro-to-cyber-security.ssh > cpe64777d6503a3-cm64777d6503a0.sdns.net.rogers.com.51538: Flags [P.], seq 39780:40056, ack 1, win 501, options [nop,nop,TS val 3378381074 ecr 803750564], length 276
09:03:59.137366 IP comp3134-winter-2022-intro-to-cyber-security.ssh > cpe64777d6503a3-cm64777d6503a0.sdns.net.rogers.com.51538: Flags [P.], seq 40056:40332, ack 1, win 501, options [nop,nop,TS val 3378381074 ecr 803750564], length 276
09:03:59.137454 IP comp3134-winter-2022-intro-to-cyber-security.ssh > cpe64777d6503a3-cm64777d6503a0.sdns.net.rogers.com.51538: Flags [P.], seq 40332:40608, ack 1, win 501, options [nop,nop,TS val 3378381074 ecr 803750564], length 276
09:03:59.137540 IP comp3134-winter-2022-intro-to-cyber-security.ssh > cpe64777d6503a3-cm64777d6503a0.sdns.net.rogers.com.51538: Flags [P.], seq 40608:40884, ack 1, win 501, options [nop,nop,TS val 3378381074 ecr 803750564], length 276
09:03:59.137625 IP comp3134-winter-2022-intro-to-cyber-security.ssh > cpe64777d6503a3-cm64777d6503a0.sdns.net.rogers.com.51538: Flags [P.], seq 40884:41160, ack 1, win 501, options [nop,nop,TS val 3378381075 ecr 803750564], length 276
09:03:59.137718 IP comp3134-winter-2022-intro-to-cyber-security.ssh > cpe64777d6503a3-cm64777d6503a0.sdns.net.rogers.com.51538: Flags [P.], seq 41160:41436, ack 1, win 501, options [nop,nop,TS val 3378381075 ecr 803750564], length 276
09:03:59.137808 IP comp3134-winter-2022-intro-to-cyber-security.ssh > cpe64777d6503a3-cm64777d6503a0.sdns.net.rogers.com.51538: Flags [P.], seq 41436:41712, ack 1, win 501, options [nop,nop,TS val 3378381075 ecr 803750564], length 276
09:03:59.137893 IP comp3134-winter-2022-intro-to-cyber-security.ssh > cpe64777d6503a3-cm64777d6503a0.sdns.net.rogers.com.51538: Flags [P.], seq 41712:41988, ack 1, win 501, options [nop,nop,TS val 3378381075 ecr 803750564], length 276
09:03:59.137982 IP comp3134-winter-2022-intro-to-cyber-security.ssh > cpe64777d6503a3-cm64777d6503a0.sdns.net.rogers.com.51538: Flags [P.], seq 41988:42264, ack 1, win 501, options [nop,nop,TS val 3378381075 ecr 803750564], length 276
09:03:59.138067 IP comp3134-winter-2022-intro-to-cyber-security.ssh > cpe64777d6503a3-cm64777d6503a0.sdns.net.rogers.com.51538: Flags [P.], seq 42264:42540, ack 1, win 501, options [nop,nop,TS val 3378381075 ecr 803750564], length 276
09:03:59.138152 IP comp3134-winter-2022-intro-to-cyber-security.ssh > cpe64777d6503a3-cm64777d6503a0.sdns.net.rogers.com.51538: Flags [P.], seq 42540:42816, ack 1, win 501, options [nop,nop,TS val 3378381075 ecr 803750564], length 276
09:03:59.138235 IP comp3134-winter-2022-intro-to-cyber-security.ssh > cpe64777d6503a3-cm64777d6503a0.sdns.net.rogers.com.51538: Flags [P.], seq 42816:43092, ack 1, win 501, options [nop,nop,TS val 3378381075 ecr 803750564], length 276
09:03:59.138323 IP comp3134-winter-2022-intro-to-cyber-security.ssh > cpe64777d6503a3-cm64777d6503a0.sdns.net.rogers.com.51538: Flags [P.], seq 43092:43368, ack 1, win 501, options [nop,nop,TS val 3378381075 ecr 803750564], length 276
09:03:59.138445 IP comp3134-winter-2022-intro-to-cyber-security.ssh > cpe64777d6503a3-cm64777d6503a0.sdns.net.rogers.com.51538: Flags [P.], seq 43368:43644, ack 1, win 501, options [nop,nop,TS val 3378381075 ecr 803750564], length 276
09:03:59.138531 IP comp3134-winter-2022-intro-to-cyber-security.ssh > cpe64777d6503a3-cm64777d6503a0.sdns.net.rogers.com.51538: Flags [P.], seq 43644:43920, ack 1, win 501, options [nop,nop,TS val 3378381075 ecr 803750564], length 276
09:03:59.138618 IP comp3134-winter-2022-intro-to-cyber-security.ssh > cpe64777d6503a3-cm64777d6503a0.sdns.net.rogers.com.51538: Flags [P.], seq 43920:44196, ack 1, win 501, options [nop,nop,TS val 3378381076 ecr 803750564], length 276
09:03:59.138701 IP comp3134-winter-2022-intro-to-cyber-security.ssh > cpe64777d6503a3-cm64777d6503a0.sdns.net.rogers.com.51538: Flags [P.], seq 44196:44472, ack 1, win 501, options [nop,nop,TS val 3378381076 ecr 803750564], length 276
09:03:59.138797 IP comp3134-winter-2022-intro-to-cyber-security.ssh > cpe64777d6503a3-cm64777d6503a0.sdns.net.rogers.com.51538: Flags [P.], seq 44472:44748, ack 1, win 501, options [nop,nop,TS val 3378381076 ecr 803750564], length 276
09:03:59.138887 IP comp3134-winter-2022-intro-to-cyber-security.ssh > cpe64777d6503a3-cm64777d6503a0.sdns.net.rogers.com.51538: Flags [P.], seq 44748:45024, ack 1, win 501, options [nop,nop,TS val 3378381076 ecr 803750564], length 276
09:03:59.138972 IP comp3134-winter-2022-intro-to-cyber-security.ssh > cpe64777d6503a3-cm64777d6503a0.sdns.net.rogers.com.51538: Flags [P.], seq 45024:45300, ack 1, win 501, options [nop,nop,TS val 3378381076 ecr 803750564], length 276
09:03:59.139054 IP comp3134-winter-2022-intro-to-cyber-security.ssh > cpe64777d6503a3-cm64777d6503a0.sdns.net.rogers.com.51538: Flags [P.], seq 45300:45576, ack 1, win 501, options [nop,nop,TS val 3378381076 ecr 803750564], length 276
09:03:59.139137 IP comp3134-winter-2022-intro-to-cyber-security.ssh > cpe64777d6503a3-cm64777d6503a0.sdns.net.rogers.com.51538: Flags [P.], seq 45576:45852, ack 1, win 501, options [nop,nop,TS val 3378381076 ecr 803750564], length 276
09:03:59.139220 IP comp3134-winter-2022-intro-to-cyber-security.ssh > cpe64777d6503a3-cm64777d6503a0.sdns.net.rogers.com.51538: Flags [P.], seq 45852:46128, ack 1, win 501, options [nop,nop,TS val 3378381076 ecr 803750564], length 276
09:03:59.139277 IP cpe64777d6503a3-cm64777d6503a0.sdns.net.rogers.com.51538 > comp3134-winter-2022-intro-to-cyber-security.ssh: Flags [.], ack 19248, win 514, options [nop,nop,TS val 803750569 ecr 3378381050], length 0
09:03:59.139277 IP cpe64777d6503a3-cm64777d6503a0.sdns.net.rogers.com.51538 > comp3134-winter-2022-intro-to-cyber-security.ssh: Flags [.], ack 22144, win 514, options [nop,nop,TS val 803750571 ecr 3378381057], length 0
09:03:59.139277 IP cpe64777d6503a3-cm64777d6503a0.sdns.net.rogers.com.51538 > comp3134-winter-2022-intro-to-cyber-security.ssh: Flags [.], ack 23524, win 509, options [nop,nop,TS val 803750571 ecr 3378381057], length 0
09:03:59.139277 IP cpe64777d6503a3-cm64777d6503a0.sdns.net.rogers.com.51538 > comp3134-winter-2022-intro-to-cyber-security.ssh: Flags [.], ack 23812, win 514, options [nop,nop,TS val 803750571 ecr 3378381057], length 0
09:03:59.139277 IP cpe64777d6503a3-cm64777d6503a0.sdns.net.rogers.com.51538 > comp3134-winter-2022-intro-to-cyber-security.ssh: Flags [.], ack 24100, win 513, options [nop,nop,TS val 803750571 ecr 3378381057], length 0
