root@comp3134-winter-2022-intro-to-cyber-security:~# tcpdump -n -i eth0
tcpdump: verbose output suppressed, use -v or -vv for full protocol decode
listening on eth0, link-type EN10MB (Ethernet), capture size 262144 bytes
09:00:52.685908 IP 147.182.158.58.22 > 99.253.10.247.51537: Flags [P.], seq 1598836865:1598836973, ack 3588363604, win 501, options [nop,nop,TS val 3378194623 ecr 803564108], length 108
09:00:52.685987 IP 147.182.158.58.22 > 99.253.10.247.51537: Flags [P.], seq 108:144, ack 1, win 501, options [nop,nop,TS val 3378194623 ecr 803564108], length 36
09:00:52.686036 IP 147.182.158.58.22 > 99.253.10.247.51537: Flags [P.], seq 144:252, ack 1, win 501, options [nop,nop,TS val 3378194623 ecr 803564108], length 108
09:00:52.686081 IP 147.182.158.58.22 > 99.253.10.247.51537: Flags [P.], seq 252:288, ack 1, win 501, options [nop,nop,TS val 3378194623 ecr 803564108], length 36
09:00:52.686208 IP 147.182.158.58.22 > 99.253.10.247.51537: Flags [P.], seq 288:508, ack 1, win 501, options [nop,nop,TS val 3378194623 ecr 803564108], length 220
09:00:52.686256 IP 147.182.158.58.22 > 99.253.10.247.51537: Flags [P.], seq 508:544, ack 1, win 501, options [nop,nop,TS val 3378194623 ecr 803564108], length 36
09:00:52.686315 IP 147.182.158.58.22 > 99.253.10.247.51537: Flags [P.], seq 544:740, ack 1, win 501, options [nop,nop,TS val 3378194623 ecr 803564108], length 196
09:00:52.686363 IP 147.182.158.58.22 > 99.253.10.247.51537: Flags [P.], seq 740:776, ack 1, win 501, options [nop,nop,TS val 3378194623 ecr 803564108], length 36
09:00:52.686442 IP 147.182.158.58.22 > 99.253.10.247.51537: Flags [P.], seq 776:972, ack 1, win 501, options [nop,nop,TS val 3378194623 ecr 803564108], length 196
09:00:52.696506 IP 46.101.94.164.44262 > 147.182.158.58.22: Flags [.], ack 3837744958, win 501, options [nop,nop,TS val 1753786754 ecr 847689898,nop,nop,sack 1 {4294967229:1}], length 0
09:00:52.696555 IP 147.182.158.58 > 46.101.94.164: ICMP 147.182.158.58 tcp port 22 unreachable, length 72
09:00:52.702603 IP 99.253.10.247.51537 > 147.182.158.58.22: Flags [.], ack 740, win 512, options [nop,nop,TS val 803564137 ecr 3378194623], length 0
09:00:52.702603 IP 99.253.10.247.51537 > 147.182.158.58.22: Flags [.], ack 972, win 511, options [nop,nop,TS val 803564137 ecr 3378194623], length 0
09:00:52.702652 IP 147.182.158.58.22 > 99.253.10.247.51537: Flags [P.], seq 972:2732, ack 1, win 501, options [nop,nop,TS val 3378194640 ecr 803564137], length 1760
09:00:52.702817 IP 147.182.158.58.22 > 99.253.10.247.51537: Flags [P.], seq 2732:3232, ack 1, win 501, options [nop,nop,TS val 3378194640 ecr 803564137], length 500
09:00:52.702886 IP 147.182.158.58.22 > 99.253.10.247.51537: Flags [P.], seq 3232:3436, ack 1, win 501, options [nop,nop,TS val 3378194640 ecr 803564137], length 204
09:00:52.702958 IP 147.182.158.58.22 > 99.253.10.247.51537: Flags [P.], seq 3436:3640, ack 1, win 501, options [nop,nop,TS val 3378194640 ecr 803564137], length 204
09:00:52.703024 IP 147.182.158.58.22 > 99.253.10.247.51537: Flags [P.], seq 3640:3844, ack 1, win 501, options [nop,nop,TS val 3378194640 ecr 803564137], length 204
09:00:52.703089 IP 147.182.158.58.22 > 99.253.10.247.51537: Flags [P.], seq 3844:4048, ack 1, win 501, options [nop,nop,TS val 3378194640 ecr 803564137], length 204
09:00:52.703149 IP 147.182.158.58.22 > 99.253.10.247.51537: Flags [P.], seq 4048:4252, ack 1, win 501, options [nop,nop,TS val 3378194640 ecr 803564137], length 204
09:00:52.703211 IP 147.182.158.58.22 > 99.253.10.247.51537: Flags [P.], seq 4252:4456, ack 1, win 501, options [nop,nop,TS val 3378194640 ecr 803564137], length 204
09:00:52.703271 IP 147.182.158.58.22 > 99.253.10.247.51537: Flags [P.], seq 4456:4660, ack 1, win 501, options [nop,nop,TS val 3378194640 ecr 803564137], length 204
09:00:52.703332 IP 147.182.158.58.22 > 99.253.10.247.51537: Flags [P.], seq 4660:4864, ack 1, win 501, options [nop,nop,TS val 3378194640 ecr 803564137], length 204
09:00:52.703392 IP 147.182.158.58.22 > 99.253.10.247.51537: Flags [P.], seq 4864:5068, ack 1, win 501, options [nop,nop,TS val 3378194640 ecr 803564137], length 204
09:00:52.703452 IP 147.182.158.58.22 > 99.253.10.247.51537: Flags [P.], seq 5068:5272, ack 1, win 501, options [nop,nop,TS val 3378194640 ecr 803564137], length 204
09:00:52.703509 IP 147.182.158.58.22 > 99.253.10.247.51537: Flags [P.], seq 5272:5476, ack 1, win 501, options [nop,nop,TS val 3378194640 ecr 803564137], length 204
09:00:52.703554 IP 147.182.158.58.22 > 99.253.10.247.51537: Flags [P.], seq 5476:5512, ack 1, win 501, options [nop,nop,TS val 3378194640 ecr 803564137], length 36
09:00:52.703608 IP 147.182.158.58.22 > 99.253.10.247.51537: Flags [P.], seq 5512:5716, ack 1, win 501, options [nop,nop,TS val 3378194641 ecr 803564137], length 204
09:00:52.703651 IP 147.182.158.58.22 > 99.253.10.247.51537: Flags [P.], seq 5716:5752, ack 1, win 501, options [nop,nop,TS val 3378194641 ecr 803564137], length 36
09:00:52.703705 IP 147.182.158.58.22 > 99.253.10.247.51537: Flags [P.], seq 5752:5956, ack 1, win 501, options [nop,nop,TS val 3378194641 ecr 803564137], length 204
09:00:52.703745 IP 147.182.158.58.22 > 99.253.10.247.51537: Flags [P.], seq 5956:5992, ack 1, win 501, options [nop,nop,TS val 3378194641 ecr 803564137], length 36
09:00:52.703798 IP 147.182.158.58.22 > 99.253.10.247.51537: Flags [P.], seq 5992:6196, ack 1, win 501, options [nop,nop,TS val 3378194641 ecr 803564137], length 204
09:00:52.719523 IP 99.253.10.247.51537 > 147.182.158.58.22: Flags [.], ack 6196, win 512, options [nop,nop,TS val 803564154 ecr 3378194641], length 0
09:00:52.719595 IP 147.182.158.58.22 > 99.253.10.247.51537: Flags [P.], seq 6196:7192, ack 1, win 501, options [nop,nop,TS val 3378194657 ecr 803564154], length 996
09:00:52.719762 IP 147.182.158.58.22 > 99.253.10.247.51537: Flags [P.], seq 7192:7380, ack 1, win 501, options [nop,nop,TS val 3378194657 ecr 803564154], length 188
09:00:52.719818 IP 147.182.158.58.22 > 99.253.10.247.51537: Flags [P.], seq 7380:7416, ack 1, win 501, options [nop,nop,TS val 3378194657 ecr 803564154], length 36
09:00:52.719878 IP 147.182.158.58.22 > 99.253.10.247.51537: Flags [P.], seq 7416:7620, ack 1, win 501, options [nop,nop,TS val 3378194657 ecr 803564154], length 204
09:00:52.719922 IP 147.182.158.58.22 > 99.253.10.247.51537: Flags [P.], seq 7620:7656, ack 1, win 501, options [nop,nop,TS val 3378194657 ecr 803564154], length 36
09:00:52.719996 IP 147.182.158.58.22 > 99.253.10.247.51537: Flags [P.], seq 7656:7860, ack 1, win 501, options [nop,nop,TS val 3378194657 ecr 803564154], length 204
09:00:52.720041 IP 147.182.158.58.22 > 99.253.10.247.51537: Flags [P.], seq 7860:7896, ack 1, win 501, options [nop,nop,TS val 3378194657 ecr 803564154], length 36
09:00:52.720104 IP 147.182.158.58.22 > 99.253.10.247.51537: Flags [P.], seq 7896:8100, ack 1, win 501, options [nop,nop,TS val 3378194657 ecr 803564154], length 204
09:00:52.720149 IP 147.182.158.58.22 > 99.253.10.247.51537: Flags [P.], seq 8100:8136, ack 1, win 501, options [nop,nop,TS val 3378194657 ecr 803564154], length 36
09:00:52.720202 IP 147.182.158.58.22 > 99.253.10.247.51537: Flags [P.], seq 8136:8340, ack 1, win 501, options [nop,nop,TS val 3378194657 ecr 803564154], length 204
09:00:52.720244 IP 147.182.158.58.22 > 99.253.10.247.51537: Flags [P.], seq 8340:8376, ack 1, win 501, options [nop,nop,TS val 3378194657 ecr 803564154], length 36
09:00:52.720297 IP 147.182.158.58.22 > 99.253.10.247.51537: Flags [P.], seq 8376:8580, ack 1, win 501, options [nop,nop,TS val 3378194657 ecr 803564154], length 204
09:00:52.720340 IP 147.182.158.58.22 > 99.253.10.247.51537: Flags [P.], seq 8580:8616, ack 1, win 501, options [nop,nop,TS val 3378194657 ecr 803564154], length 36
09:00:52.720392 IP 147.182.158.58.22 > 99.253.10.247.51537: Flags [P.], seq 8616:8820, ack 1, win 501, options [nop,nop,TS val 3378194657 ecr 803564154], length 204
09:00:52.720436 IP 147.182.158.58.22 > 99.253.10.247.51537: Flags [P.], seq 8820:8856, ack 1, win 501, options [nop,nop,TS val 3378194657 ecr 803564154], length 36
09:00:52.720489 IP 147.182.158.58.22 > 99.253.10.247.51537: Flags [P.], seq 8856:9060, ack 1, win 501, options [nop,nop,TS val 3378194657 ecr 803564154], length 204
09:00:52.720531 IP 147.182.158.58.22 > 99.253.10.247.51537: Flags [P.], seq 9060:9096, ack 1, win 501, options [nop,nop,TS val 3378194657 ecr 803564154], length 36
09:00:52.720584 IP 147.182.158.58.22 > 99.253.10.247.51537: Flags [P.], seq 9096:9300, ack 1, win 501, options [nop,nop,TS val 3378194658 ecr 803564154], length 204
09:00:52.720627 IP 147.182.158.58.22 > 99.253.10.247.51537: Flags [P.], seq 9300:9336, ack 1, win 501, options [nop,nop,TS val 3378194658 ecr 803564154], length 36
09:00:52.720679 IP 147.182.158.58.22 > 99.253.10.247.51537: Flags [P.], seq 9336:9540, ack 1, win 501, options [nop,nop,TS val 3378194658 ecr 803564154], length 204
09:00:52.720720 IP 147.182.158.58.22 > 99.253.10.247.51537: Flags [P.], seq 9540:9576, ack 1, win 501, options [nop,nop,TS val 3378194658 ecr 803564154], length 36
09:00:52.720783 IP 147.182.158.58.22 > 99.253.10.247.51537: Flags [P.], seq 9576:9780, ack 1, win 501, options [nop,nop,TS val 3378194658 ecr 803564154], length 204
09:00:52.720826 IP 147.182.158.58.22 > 99.253.10.247.51537: Flags [P.], seq 9780:9816, ack 1, win 501, options [nop,nop,TS val 3378194658 ecr 803564154], length 36
09:00:52.720878 IP 147.182.158.58.22 > 99.253.10.247.51537: Flags [P.], seq 9816:10020, ack 1, win 501, options [nop,nop,TS val 3378194658 ecr 803564154], length 204
09:00:52.720919 IP 147.182.158.58.22 > 99.253.10.247.51537: Flags [P.], seq 10020:10056, ack 1, win 501, options [nop,nop,TS val 3378194658 ecr 803564154], length 36
09:00:52.720972 IP 147.182.158.58.22 > 99.253.10.247.51537: Flags [P.], seq 10056:10260, ack 1, win 501, options [nop,nop,TS val 3378194658 ecr 803564154], length 204
09:00:52.721012 IP 147.182.158.58.22 > 99.253.10.247.51537: Flags [P.], seq 10260:10296, ack 1, win 501, options [nop,nop,TS val 3378194658 ecr 803564154], length 36
09:00:52.721072 IP 147.182.158.58.22 > 99.253.10.247.51537: Flags [P.], seq 10296:10500, ack 1, win 501, options [nop,nop,TS val 3378194658 ecr 803564154], length 204
09:00:52.721142 IP 147.182.158.58.22 > 99.253.10.247.51537: Flags [P.], seq 10500:10536, ack 1, win 501, options [nop,nop,TS val 3378194658 ecr 803564154], length 36
09:00:52.721207 IP 147.182.158.58.22 > 99.253.10.247.51537: Flags [P.], seq 10536:10740, ack 1, win 501, options [nop,nop,TS val 3378194658 ecr 803564154], length 204
09:00:52.721251 IP 147.182.158.58.22 > 99.253.10.247.51537: Flags [P.], seq 10740:10776, ack 1, win 501, options [nop,nop,TS val 3378194658 ecr 803564154], length 36
09:00:52.721305 IP 147.182.158.58.22 > 99.253.10.247.51537: Flags [P.], seq 10776:10980, ack 1, win 501, options [nop,nop,TS val 3378194658 ecr 803564154], length 204
09:00:52.721346 IP 147.182.158.58.22 > 99.253.10.247.51537: Flags [P.], seq 10980:11016, ack 1, win 501, options [nop,nop,TS val 3378194658 ecr 803564154], length 36
09:00:52.721399 IP 147.182.158.58.22 > 99.253.10.247.51537: Flags [P.], seq 11016:11220, ack 1, win 501, options [nop,nop,TS val 3378194658 ecr 803564154], length 204
09:00:52.721444 IP 147.182.158.58.22 > 99.253.10.247.51537: Flags [P.], seq 11220:11256, ack 1, win 501, options [nop,nop,TS val 3378194658 ecr 803564154], length 36
09:00:52.721498 IP 147.182.158.58.22 > 99.253.10.247.51537: Flags [P.], seq 11256:11460, ack 1, win 501, options [nop,nop,TS val 3378194658 ecr 803564154], length 204
09:00:52.721541 IP 147.182.158.58.22 > 99.253.10.247.51537: Flags [P.], seq 11460:11496, ack 1, win 501, options [nop,nop,TS val 3378194658 ecr 803564154], length 36
09:00:52.721594 IP 147.182.158.58.22 > 99.253.10.247.51537: Flags [P.], seq 11496:11700, ack 1, win 501, options [nop,nop,TS val 3378194659 ecr 803564154], length 204
09:00:52.721637 IP 147.182.158.58.22 > 99.253.10.247.51537: Flags [P.], seq 11700:11736, ack 1, win 501, options [nop,nop,TS val 3378194659 ecr 803564154], length 36
09:00:52.721690 IP 147.182.158.58.22 > 99.253.10.247.51537: Flags [P.], seq 11736:11940, ack 1, win 501, options [nop,nop,TS val 3378194659 ecr 803564154], length 204
09:00:52.734759 IP 99.253.10.247.51537 > 147.182.158.58.22: Flags [.], ack 7620, win 513, options [nop,nop,TS val 803564170 ecr 3378194657], length 0
09:00:52.734842 IP 147.182.158.58.22 > 99.253.10.247.51537: Flags [P.], seq 11940:11976, ack 1, win 501, options [nop,nop,TS val 3378194672 ecr 803564170], length 36
09:00:52.734950 IP 147.182.158.58.22 > 99.253.10.247.51537: Flags [P.], seq 11976:14872, ack 1, win 501, options [nop,nop,TS val 3378194672 ecr 803564170], length 2896
09:00:52.734975 IP 147.182.158.58.22 > 99.253.10.247.51537: Flags [P.], seq 14872:17016, ack 1, win 501, options [nop,nop,TS val 3378194672 ecr 803564170], length 2144
09:00:52.735128 IP 147.182.158.58.22 > 99.253.10.247.51537: Flags [P.], seq 17016:17204, ack 1, win 501, options [nop,nop,TS val 3378194672 ecr 803564170], length 188
09:00:52.735194 IP 147.182.158.58.22 > 99.253.10.247.51537: Flags [P.], seq 17204:17240, ack 1, win 501, options [nop,nop,TS val 3378194672 ecr 803564170], length 36
09:00:52.735260 IP 147.182.158.58.22 > 99.253.10.247.51537: Flags [P.], seq 17240:17444, ack 1, win 501, options [nop,nop,TS val 3378194672 ecr 803564170], length 204
09:00:52.740924 IP 99.253.10.247.51537 > 147.182.158.58.22: Flags [.], ack 9300, win 513, options [nop,nop,TS val 803564175 ecr 3378194657], length 0
09:00:52.740924 IP 99.253.10.247.51537 > 147.182.158.58.22: Flags [.], ack 9540, win 512, options [nop,nop,TS val 803564175 ecr 3378194658], length 0
09:00:52.740981 IP 147.182.158.58.22 > 99.253.10.247.51537: Flags [P.], seq 17444:18680, ack 1, win 501, options [nop,nop,TS val 3378194678 ecr 803564175], length 1236
09:00:52.741156 IP 147.182.158.58.22 > 99.253.10.247.51537: Flags [P.], seq 18680:18868, ack 1, win 501, options [nop,nop,TS val 3378194678 ecr 803564175], length 188
09:00:52.741255 IP 147.182.158.58.22 > 99.253.10.247.51537: Flags [P.], seq 18868:18904, ack 1, win 501, options [nop,nop,TS val 3378194678 ecr 803564175], length 36
09:00:52.741346 IP 147.182.158.58.22 > 99.253.10.247.51537: Flags [P.], seq 18904:19092, ack 1, win 501, options [nop,nop,TS val 3378194678 ecr 803564175], length 188
09:00:52.741404 IP 147.182.158.58.22 > 99.253.10.247.51537: Flags [P.], seq 19092:19128, ack 1, win 501, options [nop,nop,TS val 3378194678 ecr 803564175], length 36
09:00:52.741434 IP 14.18.144.234.36668 > 147.182.158.58.22: Flags [S], seq 435230103, win 64240, options [mss 1460,sackOK,TS val 3542014724 ecr 0,nop,wscale 7], length 0
09:00:52.741489 IP 147.182.158.58.22 > 14.18.144.234.36668: Flags [S.], seq 4277453169, ack 435230104, win 65160, options [mss 1460,sackOK,TS val 1352905761 ecr 3542014724,nop,wscale 7], length 0
09:00:52.741565 IP 147.182.158.58.22 > 99.253.10.247.51537: Flags [P.], seq 19128:19332, ack 1, win 501, options [nop,nop,TS val 3378194678 ecr 803564175], length 204
09:00:52.741637 IP 147.182.158.58.22 > 99.253.10.247.51537: Flags [P.], seq 19332:19368, ack 1, win 501, options [nop,nop,TS val 3378194679 ecr 803564175], length 36
09:00:52.741689 IP 147.182.158.58.22 > 99.253.10.247.51537: Flags [P.], seq 19368:19572, ack 1, win 501, options [nop,nop,TS val 3378194679 ecr 803564175], length 204
09:00:52.741734 IP 147.182.158.58.22 > 99.253.10.247.51537: Flags [P.], seq 19572:19608, ack 1, win 501, options [nop,nop,TS val 3378194679 ecr 803564175], length 36
09:00:52.741803 IP 147.182.158.58.22 > 99.253.10.247.51537: Flags [P.], seq 19608:19812, ack 1, win 501, options [nop,nop,TS val 3378194679 ecr 803564175], length 204
09:00:52.741846 IP 147.182.158.58.22 > 99.253.10.247.51537: Flags [P.], seq 19812:19848, ack 1, win 501, options [nop,nop,TS val 3378194679 ecr 803564175], length 36
09:00:52.741899 IP 147.182.158.58.22 > 99.253.10.247.51537: Flags [P.], seq 19848:20052, ack 1, win 501, options [nop,nop,TS val 3378194679 ecr 803564175], length 204
09:00:52.741940 IP 147.182.158.58.22 > 99.253.10.247.51537: Flags [P.], seq 20052:20088, ack 1, win 501, options [nop,nop,TS val 3378194679 ecr 803564175], length 36
09:00:52.742016 IP 147.182.158.58.22 > 99.253.10.247.51537: Flags [P.], seq 20088:20292, ack 1, win 501, options [nop,nop,TS val 3378194679 ecr 803564175], length 204
09:00:52.742060 IP 147.182.158.58.22 > 99.253.10.247.51537: Flags [P.], seq 20292:20328, ack 1, win 501, options [nop,nop,TS val 3378194679 ecr 803564175], length 36
09:00:52.742168 IP 147.182.158.58.22 > 99.253.10.247.51537: Flags [P.], seq 20328:20532, ack 1, win 501, options [nop,nop,TS val 3378194679 ecr 803564175], length 204
09:00:52.742212 IP 147.182.158.58.22 > 99.253.10.247.51537: Flags [P.], seq 20532:20568, ack 1, win 501, options [nop,nop,TS val 3378194679 ecr 803564175], length 36
09:00:52.742281 IP 147.182.158.58.22 > 99.253.10.247.51537: Flags [P.], seq 20568:20804, ack 1, win 501, options [nop,nop,TS val 3378194679 ecr 803564175], length 236
09:00:52.742327 IP 147.182.158.58.22 > 99.253.10.247.51537: Flags [P.], seq 20804:20840, ack 1, win 501, options [nop,nop,TS val 3378194679 ecr 803564175], length 36
09:00:52.742398 IP 147.182.158.58.22 > 99.253.10.247.51537: Flags [P.], seq 20840:21044, ack 1, win 501, options [nop,nop,TS val 3378194679 ecr 803564175], length 204
09:00:52.742442 IP 147.182.158.58.22 > 99.253.10.247.51537: Flags [P.], seq 21044:21080, ack 1, win 501, options [nop,nop,TS val 3378194679 ecr 803564175], length 36
09:00:52.742495 IP 147.182.158.58.22 > 99.253.10.247.51537: Flags [P.], seq 21080:21284, ack 1, win 501, options [nop,nop,TS val 3378194679 ecr 803564175], length 204
09:00:52.742538 IP 147.182.158.58.22 > 99.253.10.247.51537: Flags [P.], seq 21284:21320, ack 1, win 501, options [nop,nop,TS val 3378194679 ecr 803564175], length 36
09:00:52.742599 IP 147.182.158.58.22 > 99.253.10.247.51537: Flags [P.], seq 21320:21524, ack 1, win 501, options [nop,nop,TS val 3378194680 ecr 803564175], length 204
09:00:52.742642 IP 147.182.158.58.22 > 99.253.10.247.51537: Flags [P.], seq 21524:21560, ack 1, win 501, options [nop,nop,TS val 3378194680 ecr 803564175], length 36
09:00:52.742723 IP 147.182.158.58.22 > 99.253.10.247.51537: Flags [P.], seq 21560:21764, ack 1, win 501, options [nop,nop,TS val 3378194680 ecr 803564175], length 204
09:00:52.742788 IP 147.182.158.58.22 > 99.253.10.247.51537: Flags [P.], seq 21764:21800, ack 1, win 501, options [nop,nop,TS val 3378194680 ecr 803564175], length 36
09:00:52.742849 IP 147.182.158.58.22 > 99.253.10.247.51537: Flags [P.], seq 21800:22004, ack 1, win 501, options [nop,nop,TS val 3378194680 ecr 803564175], length 204
09:00:52.742893 IP 147.182.158.58.22 > 99.253.10.247.51537: Flags [P.], seq 22004:22040, ack 1, win 501, options [nop,nop,TS val 3378194680 ecr 803564175], length 36
09:00:52.742946 IP 147.182.158.58.22 > 99.253.10.247.51537: Flags [P.], seq 22040:22244, ack 1, win 501, options [nop,nop,TS val 3378194680 ecr 803564175], length 204
09:00:52.742988 IP 147.182.158.58.22 > 99.253.10.247.51537: Flags [P.], seq 22244:22280, ack 1, win 501, options [nop,nop,TS val 3378194680 ecr 803564175], length 36
09:00:52.743040 IP 147.182.158.58.22 > 99.253.10.247.51537: Flags [P.], seq 22280:22484, ack 1, win 501, options [nop,nop,TS val 3378194680 ecr 803564175], length 204
09:00:52.748795 IP 99.253.10.247.51537 > 147.182.158.58.22: Flags [.], ack 10500, win 509, options [nop,nop,TS val 803564176 ecr 3378194658], length 0
09:00:52.748795 IP 99.253.10.247.51537 > 147.182.158.58.22: Flags [.], ack 11460, win 511, options [nop,nop,TS val 803564176 ecr 3378194658], length 0
09:00:52.748795 IP 99.253.10.247.51537 > 147.182.158.58.22: Flags [.], ack 11940, win 510, options [nop,nop,TS val 803564176 ecr 3378194659], length 0
09:00:52.748836 IP 147.182.158.58.22 > 99.253.10.247.51537: Flags [P.], seq 22484:27320, ack 1, win 501, options [nop,nop,TS val 3378194686 ecr 803564176], length 4836
09:00:52.749001 IP 147.182.158.58.22 > 99.253.10.247.51537: Flags [P.], seq 27320:27508, ack 1, win 501, options [nop,nop,TS val 3378194686 ecr 803564176], length 188
09:00:52.749074 IP 147.182.158.58.22 > 99.253.10.247.51537: Flags [P.], seq 27508:27544, ack 1, win 501, options [nop,nop,TS val 3378194686 ecr 803564176], length 36
09:00:52.749155 IP 147.182.158.58.22 > 99.253.10.247.51537: Flags [P.], seq 27544:27732, ack 1, win 501, options [nop,nop,TS val 3378194686 ecr 803564176], length 188
09:00:52.749218 IP 147.182.158.58.22 > 99.253.10.247.51537: Flags [P.], seq 27732:27768, ack 1, win 501, options [nop,nop,TS val 3378194686 ecr 803564176], length 36
09:00:52.749300 IP 147.182.158.58.22 > 99.253.10.247.51537: Flags [P.], seq 27768:27956, ack 1, win 501, options [nop,nop,TS val 3378194686 ecr 803564176], length 188
09:00:52.749364 IP 147.182.158.58.22 > 99.253.10.247.51537: Flags [P.], seq 27956:27992, ack 1, win 501, options [nop,nop,TS val 3378194686 ecr 803564176], length 36
09:00:52.749448 IP 147.182.158.58.22 > 99.253.10.247.51537: Flags [P.], seq 27992:28196, ack 1, win 501, options [nop,nop,TS val 3378194686 ecr 803564176], length 204
09:00:52.749495 IP 147.182.158.58.22 > 99.253.10.247.51537: Flags [P.], seq 28196:28232, ack 1, win 501, options [nop,nop,TS val 3378194686 ecr 803564176], length 36
09:00:52.749552 IP 147.182.158.58.22 > 99.253.10.247.51537: Flags [P.], seq 28232:28436, ack 1, win 501, options [nop,nop,TS val 3378194686 ecr 803564176], length 204
09:00:52.749598 IP 147.182.158.58.22 > 99.253.10.247.51537: Flags [P.], seq 28436:28472, ack 1, win 501, options [nop,nop,TS val 3378194687 ecr 803564176], length 36
09:00:52.749668 IP 147.182.158.58.22 > 99.253.10.247.51537: Flags [P.], seq 28472:28676, ack 1, win 501, options [nop,nop,TS val 3378194687 ecr 803564176], length 204
09:00:52.749712 IP 147.182.158.58.22 > 99.253.10.247.51537: Flags [P.], seq 28676:28712, ack 1, win 501, options [nop,nop,TS val 3378194687 ecr 803564176], length 36
09:00:52.749767 IP 147.182.158.58.22 > 99.253.10.247.51537: Flags [P.], seq 28712:28916, ack 1, win 501, options [nop,nop,TS val 3378194687 ecr 803564176], length 204
09:00:52.749849 IP 147.182.158.58.22 > 99.253.10.247.51537: Flags [P.], seq 28916:29456, ack 1, win 501, options [nop,nop,TS val 3378194687 ecr 803564176], length 540
09:00:52.749964 IP 147.182.158.58.22 > 99.253.10.247.51537: Flags [P.], seq 29456:30668, ack 1, win 501, options [nop,nop,TS val 3378194687 ecr 803564176], length 1212
09:00:52.750044 IP 147.182.158.58.22 > 99.253.10.247.51537: Flags [P.], seq 30668:31048, ack 1, win 501, options [nop,nop,TS val 3378194687 ecr 803564176], length 380
09:00:52.750109 IP 147.182.158.58.22 > 99.253.10.247.51537: Flags [P.], seq 31048:31252, ack 1, win 501, options [nop,nop,TS val 3378194687 ecr 803564176], length 204
09:00:52.750172 IP 147.182.158.58.22 > 99.253.10.247.51537: Flags [P.], seq 31252:31456, ack 1, win 501, options [nop,nop,TS val 3378194687 ecr 803564176], length 204
09:00:52.750233 IP 147.182.158.58.22 > 99.253.10.247.51537: Flags [P.], seq 31456:31660, ack 1, win 501, options [nop,nop,TS val 3378194687 ecr 803564176], length 204
09:00:52.750302 IP 147.182.158.58.22 > 99.253.10.247.51537: Flags [P.], seq 31660:31864, ack 1, win 501, options [nop,nop,TS val 3378194687 ecr 803564176], length 204
09:00:52.750364 IP 147.182.158.58.22 > 99.253.10.247.51537: Flags [P.], seq 31864:32068, ack 1, win 501, options [nop,nop,TS val 3378194687 ecr 803564176], length 204
09:00:52.750448 IP 147.182.158.58.22 > 99.253.10.247.51537: Flags [P.], seq 32068:32272, ack 1, win 501, options [nop,nop,TS val 3378194687 ecr 803564176], length 204
09:00:52.750511 IP 147.182.158.58.22 > 99.253.10.247.51537: Flags [P.], seq 32272:32476, ack 1, win 501, options [nop,nop,TS val 3378194687 ecr 803564176], length 204
09:00:52.750572 IP 147.182.158.58.22 > 99.253.10.247.51537: Flags [P.], seq 32476:32680, ack 1, win 501, options [nop,nop,TS val 3378194688 ecr 803564176], length 204
09:00:52.750647 IP 147.182.158.58.22 > 99.253.10.247.51537: Flags [P.], seq 32680:32884, ack 1, win 501, options [nop,nop,TS val 3378194688 ecr 803564176], length 204
09:00:52.750715 IP 147.182.158.58.22 > 99.253.10.247.51537: Flags [P.], seq 32884:33088, ack 1, win 501, options [nop,nop,TS val 3378194688 ecr 803564176], length 204
09:00:52.750777 IP 147.182.158.58.22 > 99.253.10.247.51537: Flags [P.], seq 33088:33292, ack 1, win 501, options [nop,nop,TS val 3378194688 ecr 803564176], length 204
09:00:52.750839 IP 147.182.158.58.22 > 99.253.10.247.51537: Flags [P.], seq 33292:33496, ack 1, win 501, options [nop,nop,TS val 3378194688 ecr 803564176], length 204
09:00:52.750900 IP 147.182.158.58.22 > 99.253.10.247.51537: Flags [P.], seq 33496:33700, ack 1, win 501, options [nop,nop,TS val 3378194688 ecr 803564176], length 204
09:00:52.751012 IP 147.182.158.58.22 > 99.253.10.247.51537: Flags [P.], seq 33700:33904, ack 1, win 501, options [nop,nop,TS val 3378194688 ecr 803564176], length 204
09:00:52.751103 IP 147.182.158.58.22 > 99.253.10.247.51537: Flags [P.], seq 33904:34108, ack 1, win 501, options [nop,nop,TS val 3378194688 ecr 803564176], length 204
09:00:52.751190 IP 147.182.158.58.22 > 99.253.10.247.51537: Flags [P.], seq 34108:34312, ack 1, win 501, options [nop,nop,TS val 3378194688 ecr 803564176], length 204
09:00:52.751256 IP 147.182.158.58.22 > 99.253.10.247.51537: Flags [P.], seq 34312:34516, ack 1, win 501, options [nop,nop,TS val 3378194688 ecr 803564176], length 204
09:00:52.751319 IP 147.182.158.58.22 > 99.253.10.247.51537: Flags [P.], seq 34516:34720, ack 1, win 501, options [nop,nop,TS val 3378194688 ecr 803564176], length 204
09:00:52.751396 IP 147.182.158.58.22 > 99.253.10.247.51537: Flags [P.], seq 34720:34924, ack 1, win 501, options [nop,nop,TS val 3378194688 ecr 803564176], length 204
09:00:52.751460 IP 147.182.158.58.22 > 99.253.10.247.51537: Flags [P.], seq 34924:35128, ack 1, win 501, options [nop,nop,TS val 3378194688 ecr 803564176], length 204
09:00:52.755341 IP 99.253.10.247.51537 > 147.182.158.58.22: Flags [.], ack 17444, win 510, options [nop,nop,TS val 803564186 ecr 3378194672], length 0
09:00:52.755384 IP 147.182.158.58.22 > 99.253.10.247.51537: Flags [P.], seq 35128:35332, ack 1, win 501, options [nop,nop,TS val 3378194692 ecr 803564186], length 204
09:00:52.755512 IP 147.182.158.58.22 > 99.253.10.247.51537: Flags [P.], seq 35332:35688, ack 1, win 501, options [nop,nop,TS val 3378194692 ecr 803564186], length 356
09:00:52.755581 IP 147.182.158.58.22 > 99.253.10.247.51537: Flags [P.], seq 35688:35892, ack 1, win 501, options [nop,nop,TS val 3378194693 ecr 803564186], length 204
09:00:52.755649 IP 147.182.158.58.22 > 99.253.10.247.51537: Flags [P.], seq 35892:36096, ack 1, win 501, options [nop,nop,TS val 3378194693 ecr 803564186], length 204
09:00:52.755713 IP 147.182.158.58.22 > 99.253.10.247.51537: Flags [P.], seq 36096:36300, ack 1, win 501, options [nop,nop,TS val 3378194693 ecr 803564186], length 204
09:00:52.755776 IP 147.182.158.58.22 > 99.253.10.247.51537: Flags [P.], seq 36300:36504, ack 1, win 501, options [nop,nop,TS val 3378194693 ecr 803564186], length 204
09:00:52.755843 IP 147.182.158.58.22 > 99.253.10.247.51537: Flags [P.], seq 36504:36708, ack 1, win 501, options [nop,nop,TS val 3378194693 ecr 803564186], length 204
09:00:52.755904 IP 147.182.158.58.22 > 99.253.10.247.51537: Flags [P.], seq 36708:36912, ack 1, win 501, options [nop,nop,TS val 3378194693 ecr 803564186], length 204
09:00:52.755988 IP 147.182.158.58.22 > 99.253.10.247.51537: Flags [P.], seq 36912:37116, ack 1, win 501, options [nop,nop,TS val 3378194693 ecr 803564186], length 204
09:00:52.756101 IP 147.182.158.58.22 > 99.253.10.247.51537: Flags [P.], seq 37116:37320, ack 1, win 501, options [nop,nop,TS val 3378194693 ecr 803564186], length 204
09:00:52.756176 IP 147.182.158.58.22 > 99.253.10.247.51537: Flags [P.], seq 37320:37524, ack 1, win 501, options [nop,nop,TS val 3378194693 ecr 803564186], length 204
09:00:52.756240 IP 147.182.158.58.22 > 99.253.10.247.51537: Flags [P.], seq 37524:37728, ack 1, win 501, options [nop,nop,TS val 3378194693 ecr 803564186], length 204
09:00:52.756341 IP 147.182.158.58.22 > 99.253.10.247.51537: Flags [P.], seq 37728:37932, ack 1, win 501, options [nop,nop,TS val 3378194693 ecr 803564186], length 204
09:00:52.756422 IP 147.182.158.58.22 > 99.253.10.247.51537: Flags [P.], seq 37932:38136, ack 1, win 501, options [nop,nop,TS val 3378194693 ecr 803564186], length 204
09:00:52.756485 IP 147.182.158.58.22 > 99.253.10.247.51537: Flags [P.], seq 38136:38340, ack 1, win 501, options [nop,nop,TS val 3378194693 ecr 803564186], length 204
09:00:52.756551 IP 147.182.158.58.22 > 99.253.10.247.51537: Flags [P.], seq 38340:38544, ack 1, win 501, options [nop,nop,TS val 3378194693 ecr 803564186], length 204
09:00:52.761396 IP 99.253.10.247.51537 > 147.182.158.58.22: Flags [.], ack 19572, win 511, options [nop,nop,TS val 803564192 ecr 3378194679], length 0
09:00:52.761397 IP 99.253.10.247.51537 > 147.182.158.58.22: Flags [.], ack 21524, win 510, options [nop,nop,TS val 803564192 ecr 3378194679], length 0
09:00:52.761397 IP 99.253.10.247.51537 > 147.182.158.58.22: Flags [.], ack 22244, win 513, options [nop,nop,TS val 803564193 ecr 3378194680], length 0
09:00:52.761458 IP 147.182.158.58.22 > 99.253.10.247.51537: Flags [P.], seq 38544:38748, ack 1, win 501, options [nop,nop,TS val 3378194698 ecr 803564192], length 204
09:00:52.761713 IP 147.182.158.58.22 > 99.253.10.247.51537: Flags [P.], seq 38748:39408, ack 1, win 501, options [nop,nop,TS val 3378194699 ecr 803564193], length 660
09:00:52.761828 IP 147.182.158.58.22 > 99.253.10.247.51537: Flags [P.], seq 39408:39612, ack 1, win 501, options [nop,nop,TS val 3378194699 ecr 803564193], length 204
09:00:52.761937 IP 147.182.158.58.22 > 99.253.10.247.51537: Flags [P.], seq 39612:39816, ack 1, win 501, options [nop,nop,TS val 3378194699 ecr 803564193], length 204
09:00:52.762033 IP 147.182.158.58.22 > 99.253.10.247.51537: Flags [P.], seq 39816:40020, ack 1, win 501, options [nop,nop,TS val 3378194699 ecr 803564193], length 204
09:00:52.762114 IP 147.182.158.58.22 > 99.253.10.247.51537: Flags [P.], seq 40020:40224, ack 1, win 501, options [nop,nop,TS val 3378194699 ecr 803564193], length 204
09:00:52.762202 IP 147.182.158.58.22 > 99.253.10.247.51537: Flags [P.], seq 40224:40428, ack 1, win 501, options [nop,nop,TS val 3378194699 ecr 803564193], length 204
09:00:52.762267 IP 147.182.158.58.22 > 99.253.10.247.51537: Flags [P.], seq 40428:40632, ack 1, win 501, options [nop,nop,TS val 3378194699 ecr 803564193], length 204
09:00:52.762332 IP 147.182.158.58.22 > 99.253.10.247.51537: Flags [P.], seq 40632:40836, ack 1, win 501, options [nop,nop,TS val 3378194699 ecr 803564193], length 204
09:00:52.762418 IP 147.182.158.58.22 > 99.253.10.247.51537: Flags [P.], seq 40836:41040, ack 1, win 501, options [nop,nop,TS val 3378194699 ecr 803564193], length 204
09:00:52.762495 IP 147.182.158.58.22 > 99.253.10.247.51537: Flags [P.], seq 41040:41244, ack 1, win 501, options [nop,nop,TS val 3378194699 ecr 803564193], length 204
09:00:52.762561 IP 147.182.158.58.22 > 99.253.10.247.51537: Flags [P.], seq 41244:41448, ack 1, win 501, options [nop,nop,TS val 3378194699 ecr 803564193], length 204
09:00:52.762630 IP 147.182.158.58.22 > 99.253.10.247.51537: Flags [P.], seq 41448:41652, ack 1, win 501, options [nop,nop,TS val 3378194700 ecr 803564193], length 204
09:00:52.762691 IP 147.182.158.58.22 > 99.253.10.247.51537: Flags [P.], seq 41652:41856, ack 1, win 501, options [nop,nop,TS val 3378194700 ecr 803564193], length 204
09:00:52.762752 IP 147.182.158.58.22 > 99.253.10.247.51537: Flags [P.], seq 41856:42060, ack 1, win 501, options [nop,nop,TS val 3378194700 ecr 803564193], length 204
09:00:52.762812 IP 147.182.158.58.22 > 99.253.10.247.51537: Flags [P.], seq 42060:42264, ack 1, win 501, options [nop,nop,TS val 3378194700 ecr 803564193], length 204
09:00:52.762871 IP 147.182.158.58.22 > 99.253.10.247.51537: Flags [P.], seq 42264:42468, ack 1, win 501, options [nop,nop,TS val 3378194700 ecr 803564193], length 204
09:00:52.762932 IP 147.182.158.58.22 > 99.253.10.247.51537: Flags [P.], seq 42468:42672, ack 1, win 501, options [nop,nop,TS val 3378194700 ecr 803564193], length 204
09:00:52.762993 IP 147.182.158.58.22 > 99.253.10.247.51537: Flags [P.], seq 42672:42876, ack 1, win 501, options [nop,nop,TS val 3378194700 ecr 803564193], length 204
09:00:52.763055 IP 147.182.158.58.22 > 99.253.10.247.51537: Flags [P.], seq 42876:43080, ack 1, win 501, options [nop,nop,TS val 3378194700 ecr 803564193], length 204
09:00:52.763118 IP 147.182.158.58.22 > 99.253.10.247.51537: Flags [P.], seq 43080:43284, ack 1, win 501, options [nop,nop,TS val 3378194700 ecr 803564193], length 204
09:00:52.763177 IP 147.182.158.58.22 > 99.253.10.247.51537: Flags [P.], seq 43284:43488, ack 1, win 501, options [nop,nop,TS val 3378194700 ecr 803564193], length 204
09:00:52.763238 IP 147.182.158.58.22 > 99.253.10.247.51537: Flags [P.], seq 43488:43692, ack 1, win 501, options [nop,nop,TS val 3378194700 ecr 803564193], length 204
09:00:52.763299 IP 147.182.158.58.22 > 99.253.10.247.51537: Flags [P.], seq 43692:43896, ack 1, win 501, options [nop,nop,TS val 3378194700 ecr 803564193], length 204
09:00:52.763360 IP 147.182.158.58.22 > 99.253.10.247.51537: Flags [P.], seq 43896:44100, ack 1, win 501, options [nop,nop,TS val 3378194700 ecr 803564193], length 204
09:00:52.763419 IP 147.182.158.58.22 > 99.253.10.247.51537: Flags [P.], seq 44100:44304, ack 1, win 501, options [nop,nop,TS val 3378194700 ecr 803564193], length 204
09:00:52.763502 IP 147.182.158.58.22 > 99.253.10.247.51537: Flags [P.], seq 44304:44508, ack 1, win 501, options [nop,nop,TS val 3378194700 ecr 803564193], length 204
09:00:52.763565 IP 147.182.158.58.22 > 99.253.10.247.51537: Flags [P.], seq 44508:44712, ack 1, win 501, options [nop,nop,TS val 3378194700 ecr 803564193], length 204
09:00:52.763658 IP 147.182.158.58.22 > 99.253.10.247.51537: Flags [P.], seq 44712:44916, ack 1, win 501, options [nop,nop,TS val 3378194701 ecr 803564193], length 204
09:00:52.763753 IP 147.182.158.58.22 > 99.253.10.247.51537: Flags [P.], seq 44916:45120, ack 1, win 501, options [nop,nop,TS val 3378194701 ecr 803564193], length 204
09:00:52.763825 IP 147.182.158.58.22 > 99.253.10.247.51537: Flags [P.], seq 45120:45324, ack 1, win 501, options [nop,nop,TS val 3378194701 ecr 803564193], length 204
09:00:52.763916 IP 147.182.158.58.22 > 99.253.10.247.51537: Flags [P.], seq 45324:45528, ack 1, win 501, options [nop,nop,TS val 3378194701 ecr 803564193], length 204
09:00:52.764010 IP 147.182.158.58.22 > 99.253.10.247.51537: Flags [P.], seq 45528:45732, ack 1, win 501, options [nop,nop,TS val 3378194701 ecr 803564193], length 204
09:00:52.764080 IP 147.182.158.58.22 > 99.253.10.247.51537: Flags [P.], seq 45732:45936, ack 1, win 501, options [nop,nop,TS val 3378194701 ecr 803564193], length 204
09:00:52.764143 IP 147.182.158.58.22 > 99.253.10.247.51537: Flags [P.], seq 45936:46140, ack 1, win 501, options [nop,nop,TS val 3378194701 ecr 803564193], length 204
09:00:52.764206 IP 147.182.158.58.22 > 99.253.10.247.51537: Flags [P.], seq 46140:46344, ack 1, win 501, options [nop,nop,TS val 3378194701 ecr 803564193], length 204
09:00:52.764267 IP 147.182.158.58.22 > 99.253.10.247.51537: Flags [P.], seq 46344:46548, ack 1, win 501, options [nop,nop,TS val 3378194701 ecr 803564193], length 204
09:00:52.764328 IP 147.182.158.58.22 > 99.253.10.247.51537: Flags [P.], seq 46548:46752, ack 1, win 501, options [nop,nop,TS val 3378194701 ecr 803564193], length 204
09:00:52.764396 IP 147.182.158.58.22 > 99.253.10.247.51537: Flags [P.], seq 46752:46956, ack 1, win 501, options [nop,nop,TS val 3378194701 ecr 803564193], length 204
09:00:52.764458 IP 147.182.158.58.22 > 99.253.10.247.51537: Flags [P.], seq 46956:47160, ack 1, win 501, options [nop,nop,TS val 3378194701 ecr 803564193], length 204
09:00:52.764518 IP 147.182.158.58.22 > 99.253.10.247.51537: Flags [P.], seq 47160:47364, ack 1, win 501, options [nop,nop,TS val 3378194701 ecr 803564193], length 204
09:00:52.764591 IP 147.182.158.58.22 > 99.253.10.247.51537: Flags [P.], seq 47364:47568, ack 1, win 501, options [nop,nop,TS val 3378194702 ecr 803564193], length 204
09:00:52.764652 IP 147.182.158.58.22 > 99.253.10.247.51537: Flags [P.], seq 47568:47772, ack 1, win 501, options [nop,nop,TS val 3378194702 ecr 803564193], length 204
09:00:52.764725 IP 147.182.158.58.22 > 99.253.10.247.51537: Flags [P.], seq 47772:47976, ack 1, win 501, options [nop,nop,TS val 3378194702 ecr 803564193], length 204
09:00:52.764820 IP 147.182.158.58.22 > 99.253.10.247.51537: Flags [P.], seq 47976:48180, ack 1, win 501, options [nop,nop,TS val 3378194702 ecr 803564193], length 204
09:00:52.764914 IP 147.182.158.58.22 > 99.253.10.247.51537: Flags [P.], seq 48180:48384, ack 1, win 501, options [nop,nop,TS val 3378194702 ecr 803564193], length 204
09:00:52.765020 IP 147.182.158.58.22 > 99.253.10.247.51537: Flags [P.], seq 48384:48588, ack 1, win 501, options [nop,nop,TS val 3378194702 ecr 803564193], length 204
09:00:52.765110 IP 147.182.158.58.22 > 99.253.10.247.51537: Flags [P.], seq 48588:48792, ack 1, win 501, options [nop,nop,TS val 3378194702 ecr 803564193], length 204
09:00:52.765198 IP 147.182.158.58.22 > 99.253.10.247.51537: Flags [P.], seq 48792:48996, ack 1, win 501, options [nop,nop,TS val 3378194702 ecr 803564193], length 204
09:00:52.765290 IP 147.182.158.58.22 > 99.253.10.247.51537: Flags [P.], seq 48996:49200, ack 1, win 501, options [nop,nop,TS val 3378194702 ecr 803564193], length 204
09:00:52.765379 IP 147.182.158.58.22 > 99.253.10.247.51537: Flags [P.], seq 49200:49404, ack 1, win 501, options [nop,nop,TS val 3378194702 ecr 803564193], length 204
09:00:52.765473 IP 147.182.158.58.22 > 99.253.10.247.51537: Flags [P.], seq 49404:49608, ack 1, win 501, options [nop,nop,TS val 3378194702 ecr 803564193], length 204
09:00:52.765568 IP 147.182.158.58.22 > 99.253.10.247.51537: Flags [P.], seq 49608:49812, ack 1, win 501, options [nop,nop,TS val 3378194702 ecr 803564193], length 204
09:00:52.765674 IP 147.182.158.58.22 > 99.253.10.247.51537: Flags [P.], seq 49812:50016, ack 1, win 501, options [nop,nop,TS val 3378194703 ecr 803564193], length 204
09:00:52.765770 IP 147.182.158.58.22 > 99.253.10.247.51537: Flags [P.], seq 50016:50220, ack 1, win 501, options [nop,nop,TS val 3378194703 ecr 803564193], length 204
09:00:52.765866 IP 147.182.158.58.22 > 99.253.10.247.51537: Flags [P.], seq 50220:50424, ack 1, win 501, options [nop,nop,TS val 3378194703 ecr 803564193], length 204
09:00:52.765961 IP 147.182.158.58.22 > 99.253.10.247.51537: Flags [P.], seq 50424:50628, ack 1, win 501, options [nop,nop,TS val 3378194703 ecr 803564193], length 204
09:00:52.766053 IP 147.182.158.58.22 > 99.253.10.247.51537: Flags [P.], seq 50628:50832, ack 1, win 501, options [nop,nop,TS val 3378194703 ecr 803564193], length 204
09:00:52.766148 IP 147.182.158.58.22 > 99.253.10.247.51537: Flags [P.], seq 50832:51036, ack 1, win 501, options [nop,nop,TS val 3378194703 ecr 803564193], length 204
09:00:52.766229 IP 147.182.158.58.22 > 99.253.10.247.51537: Flags [P.], seq 51036:51240, ack 1, win 501, options [nop,nop,TS val 3378194703 ecr 803564193], length 204
09:00:52.769137 IP 99.253.10.247.51537 > 147.182.158.58.22: Flags [.], ack 22484, win 512, options [nop,nop,TS val 803564193 ecr 3378194680], length 0
09:00:52.769171 IP 147.182.158.58.22 > 99.253.10.247.51537: Flags [P.], seq 51240:51444, ack 1, win 501, options [nop,nop,TS val 3378194706 ecr 803564193], length 204
09:00:52.769294 IP 147.182.158.58.22 > 99.253.10.247.51537: Flags [P.], seq 51444:51800, ack 1, win 501, options [nop,nop,TS val 3378194706 ecr 803564193], length 356
09:00:52.769367 IP 147.182.158.58.22 > 99.253.10.247.51537: Flags [P.], seq 51800:52004, ack 1, win 501, options [nop,nop,TS val 3378194706 ecr 803564193], length 204
