root@comp3134-winter-2022-intro-to-cyber-security:~# tcpdump -i eth0 port 22
tcpdump: verbose output suppressed, use -v or -vv for full protocol decode
listening on eth0, link-type EN10MB (Ethernet), capture size 262144 bytes
09:08:37.598542 IP comp3134-winter-2022-intro-to-cyber-security.ssh > cpe64777d6503a3-cm64777d6503a0.sdns.net.rogers.com.51538: Flags [P.], seq 2611550719:2611550827, ack 1409050486, win 501, options [nop,nop,TS val 3378659535 ecr 804029023], length 108
09:08:37.598613 IP comp3134-winter-2022-intro-to-cyber-security.ssh > cpe64777d6503a3-cm64777d6503a0.sdns.net.rogers.com.51538: Flags [P.], seq 108:144, ack 1, win 501, options [nop,nop,TS val 3378659536 ecr 804029023], length 36
09:08:37.598671 IP comp3134-winter-2022-intro-to-cyber-security.ssh > cpe64777d6503a3-cm64777d6503a0.sdns.net.rogers.com.51538: Flags [P.], seq 144:252, ack 1, win 501, options [nop,nop,TS val 3378659536 ecr 804029023], length 108
09:08:37.598714 IP comp3134-winter-2022-intro-to-cyber-security.ssh > cpe64777d6503a3-cm64777d6503a0.sdns.net.rogers.com.51538: Flags [P.], seq 252:288, ack 1, win 501, options [nop,nop,TS val 3378659536 ecr 804029023], length 36
09:08:37.602077 IP comp3134-winter-2022-intro-to-cyber-security.ssh > cpe64777d6503a3-cm64777d6503a0.sdns.net.rogers.com.51538: Flags [P.], seq 288:580, ack 1, win 501, options [nop,nop,TS val 3378659539 ecr 804029023], length 292
09:08:37.602160 IP comp3134-winter-2022-intro-to-cyber-security.ssh > cpe64777d6503a3-cm64777d6503a0.sdns.net.rogers.com.51538: Flags [P.], seq 580:616, ack 1, win 501, options [nop,nop,TS val 3378659539 ecr 804029023], length 36
09:08:37.602278 IP comp3134-winter-2022-intro-to-cyber-security.ssh > cpe64777d6503a3-cm64777d6503a0.sdns.net.rogers.com.51538: Flags [P.], seq 616:884, ack 1, win 501, options [nop,nop,TS val 3378659539 ecr 804029023], length 268
09:08:37.602369 IP comp3134-winter-2022-intro-to-cyber-security.ssh > cpe64777d6503a3-cm64777d6503a0.sdns.net.rogers.com.51538: Flags [P.], seq 884:920, ack 1, win 501, options [nop,nop,TS val 3378659539 ecr 804029023], length 36
09:08:37.602494 IP comp3134-winter-2022-intro-to-cyber-security.ssh > cpe64777d6503a3-cm64777d6503a0.sdns.net.rogers.com.51538: Flags [P.], seq 920:1188, ack 1, win 501, options [nop,nop,TS val 3378659539 ecr 804029023], length 268
09:08:37.613193 IP cpe64777d6503a3-cm64777d6503a0.sdns.net.rogers.com.51538 > comp3134-winter-2022-intro-to-cyber-security.ssh: Flags [.], ack 252, win 509, options [nop,nop,TS val 804029047 ecr 3378659536], length 0
09:08:37.613260 IP comp3134-winter-2022-intro-to-cyber-security.ssh > cpe64777d6503a3-cm64777d6503a0.sdns.net.rogers.com.51538: Flags [P.], seq 1188:3048, ack 1, win 501, options [nop,nop,TS val 3378659550 ecr 804029047], length 1860
09:08:37.613428 IP comp3134-winter-2022-intro-to-cyber-security.ssh > cpe64777d6503a3-cm64777d6503a0.sdns.net.rogers.com.51538: Flags [P.], seq 3048:3300, ack 1, win 501, options [nop,nop,TS val 3378659550 ecr 804029047], length 252
09:08:37.613522 IP comp3134-winter-2022-intro-to-cyber-security.ssh > cpe64777d6503a3-cm64777d6503a0.sdns.net.rogers.com.51538: Flags [P.], seq 3300:3336, ack 1, win 501, options [nop,nop,TS val 3378659550 ecr 804029047], length 36
09:08:37.613609 IP comp3134-winter-2022-intro-to-cyber-security.ssh > cpe64777d6503a3-cm64777d6503a0.sdns.net.rogers.com.51538: Flags [P.], seq 3336:3604, ack 1, win 501, options [nop,nop,TS val 3378659551 ecr 804029047], length 268
09:08:37.613657 IP comp3134-winter-2022-intro-to-cyber-security.ssh > cpe64777d6503a3-cm64777d6503a0.sdns.net.rogers.com.51538: Flags [P.], seq 3604:3640, ack 1, win 501, options [nop,nop,TS val 3378659551 ecr 804029047], length 36
09:08:37.613716 IP comp3134-winter-2022-intro-to-cyber-security.ssh > cpe64777d6503a3-cm64777d6503a0.sdns.net.rogers.com.51538: Flags [P.], seq 3640:3908, ack 1, win 501, options [nop,nop,TS val 3378659551 ecr 804029047], length 268
09:08:37.613761 IP comp3134-winter-2022-intro-to-cyber-security.ssh > cpe64777d6503a3-cm64777d6503a0.sdns.net.rogers.com.51538: Flags [P.], seq 3908:3944, ack 1, win 501, options [nop,nop,TS val 3378659551 ecr 804029047], length 36
09:08:37.618741 IP cpe64777d6503a3-cm64777d6503a0.sdns.net.rogers.com.51538 > comp3134-winter-2022-intro-to-cyber-security.ssh: Flags [.], ack 1188, win 512, options [nop,nop,TS val 804029053 ecr 3378659539], length 0
09:08:37.618793 IP comp3134-winter-2022-intro-to-cyber-security.ssh > cpe64777d6503a3-cm64777d6503a0.sdns.net.rogers.com.51538: Flags [P.], seq 3944:5464, ack 1, win 501, options [nop,nop,TS val 3378659556 ecr 804029053], length 1520
09:08:37.618923 IP comp3134-winter-2022-intro-to-cyber-security.ssh > cpe64777d6503a3-cm64777d6503a0.sdns.net.rogers.com.51538: Flags [P.], seq 5464:5716, ack 1, win 501, options [nop,nop,TS val 3378659556 ecr 804029053], length 252
09:08:37.618992 IP comp3134-winter-2022-intro-to-cyber-security.ssh > cpe64777d6503a3-cm64777d6503a0.sdns.net.rogers.com.51538: Flags [P.], seq 5716:5752, ack 1, win 501, options [nop,nop,TS val 3378659556 ecr 804029053], length 36
09:08:37.619079 IP comp3134-winter-2022-intro-to-cyber-security.ssh > cpe64777d6503a3-cm64777d6503a0.sdns.net.rogers.com.51538: Flags [P.], seq 5752:6020, ack 1, win 501, options [nop,nop,TS val 3378659556 ecr 804029053], length 268
09:08:37.619166 IP comp3134-winter-2022-intro-to-cyber-security.ssh > cpe64777d6503a3-cm64777d6503a0.sdns.net.rogers.com.51538: Flags [P.], seq 6020:6056, ack 1, win 501, options [nop,nop,TS val 3378659556 ecr 804029053], length 36
09:08:37.619252 IP comp3134-winter-2022-intro-to-cyber-security.ssh > cpe64777d6503a3-cm64777d6503a0.sdns.net.rogers.com.51538: Flags [P.], seq 6056:6324, ack 1, win 501, options [nop,nop,TS val 3378659556 ecr 804029053], length 268
09:08:37.619312 IP comp3134-winter-2022-intro-to-cyber-security.ssh > cpe64777d6503a3-cm64777d6503a0.sdns.net.rogers.com.51538: Flags [P.], seq 6324:6360, ack 1, win 501, options [nop,nop,TS val 3378659556 ecr 804029053], length 36
09:08:37.619371 IP comp3134-winter-2022-intro-to-cyber-security.ssh > cpe64777d6503a3-cm64777d6503a0.sdns.net.rogers.com.51538: Flags [P.], seq 6360:6628, ack 1, win 501, options [nop,nop,TS val 3378659556 ecr 804029053], length 268
09:08:37.619414 IP comp3134-winter-2022-intro-to-cyber-security.ssh > cpe64777d6503a3-cm64777d6503a0.sdns.net.rogers.com.51538: Flags [P.], seq 6628:6664, ack 1, win 501, options [nop,nop,TS val 3378659556 ecr 804029053], length 36
09:08:37.619471 IP comp3134-winter-2022-intro-to-cyber-security.ssh > cpe64777d6503a3-cm64777d6503a0.sdns.net.rogers.com.51538: Flags [P.], seq 6664:6932, ack 1, win 501, options [nop,nop,TS val 3378659556 ecr 804029053], length 268
09:08:37.619514 IP comp3134-winter-2022-intro-to-cyber-security.ssh > cpe64777d6503a3-cm64777d6503a0.sdns.net.rogers.com.51538: Flags [P.], seq 6932:6968, ack 1, win 501, options [nop,nop,TS val 3378659556 ecr 804029053], length 36
09:08:37.634771 IP cpe64777d6503a3-cm64777d6503a0.sdns.net.rogers.com.51538 > comp3134-winter-2022-intro-to-cyber-security.ssh: Flags [.], ack 3944, win 511, options [nop,nop,TS val 804029067 ecr 3378659551], length 0
09:08:37.634862 IP comp3134-winter-2022-intro-to-cyber-security.ssh > cpe64777d6503a3-cm64777d6503a0.sdns.net.rogers.com.51538: Flags [P.], seq 6968:9096, ack 1, win 501, options [nop,nop,TS val 3378659572 ecr 804029067], length 2128
09:08:37.635090 IP comp3134-winter-2022-intro-to-cyber-security.ssh > cpe64777d6503a3-cm64777d6503a0.sdns.net.rogers.com.51538: Flags [P.], seq 9096:9348, ack 1, win 501, options [nop,nop,TS val 3378659572 ecr 804029067], length 252
09:08:37.635181 IP comp3134-winter-2022-intro-to-cyber-security.ssh > cpe64777d6503a3-cm64777d6503a0.sdns.net.rogers.com.51538: Flags [P.], seq 9348:9384, ack 1, win 501, options [nop,nop,TS val 3378659572 ecr 804029067], length 36
09:08:37.635292 IP comp3134-winter-2022-intro-to-cyber-security.ssh > cpe64777d6503a3-cm64777d6503a0.sdns.net.rogers.com.51538: Flags [P.], seq 9384:9652, ack 1, win 501, options [nop,nop,TS val 3378659572 ecr 804029067], length 268
09:08:37.635358 IP comp3134-winter-2022-intro-to-cyber-security.ssh > cpe64777d6503a3-cm64777d6503a0.sdns.net.rogers.com.51538: Flags [P.], seq 9652:9688, ack 1, win 501, options [nop,nop,TS val 3378659572 ecr 804029067], length 36
09:08:37.635450 IP comp3134-winter-2022-intro-to-cyber-security.ssh > cpe64777d6503a3-cm64777d6503a0.sdns.net.rogers.com.51538: Flags [P.], seq 9688:9956, ack 1, win 501, options [nop,nop,TS val 3378659572 ecr 804029067], length 268
09:08:37.635525 IP comp3134-winter-2022-intro-to-cyber-security.ssh > cpe64777d6503a3-cm64777d6503a0.sdns.net.rogers.com.51538: Flags [P.], seq 9956:9992, ack 1, win 501, options [nop,nop,TS val 3378659572 ecr 804029067], length 36
09:08:37.635631 IP comp3134-winter-2022-intro-to-cyber-security.ssh > cpe64777d6503a3-cm64777d6503a0.sdns.net.rogers.com.51538: Flags [P.], seq 9992:10260, ack 1, win 501, options [nop,nop,TS val 3378659573 ecr 804029067], length 268
09:08:37.635702 IP comp3134-winter-2022-intro-to-cyber-security.ssh > cpe64777d6503a3-cm64777d6503a0.sdns.net.rogers.com.51538: Flags [P.], seq 10260:10296, ack 1, win 501, options [nop,nop,TS val 3378659573 ecr 804029067], length 36
09:08:37.635791 IP comp3134-winter-2022-intro-to-cyber-security.ssh > cpe64777d6503a3-cm64777d6503a0.sdns.net.rogers.com.51538: Flags [P.], seq 10296:10564, ack 1, win 501, options [nop,nop,TS val 3378659573 ecr 804029067], length 268
09:08:37.635862 IP comp3134-winter-2022-intro-to-cyber-security.ssh > cpe64777d6503a3-cm64777d6503a0.sdns.net.rogers.com.51538: Flags [P.], seq 10564:10600, ack 1, win 501, options [nop,nop,TS val 3378659573 ecr 804029067], length 36
09:08:37.635988 IP comp3134-winter-2022-intro-to-cyber-security.ssh > cpe64777d6503a3-cm64777d6503a0.sdns.net.rogers.com.51538: Flags [P.], seq 10600:10868, ack 1, win 501, options [nop,nop,TS val 3378659573 ecr 804029067], length 268
09:08:37.636056 IP comp3134-winter-2022-intro-to-cyber-security.ssh > cpe64777d6503a3-cm64777d6503a0.sdns.net.rogers.com.51538: Flags [P.], seq 10868:10904, ack 1, win 501, options [nop,nop,TS val 3378659573 ecr 804029067], length 36
09:08:37.636149 IP comp3134-winter-2022-intro-to-cyber-security.ssh > cpe64777d6503a3-cm64777d6503a0.sdns.net.rogers.com.51538: Flags [P.], seq 10904:11172, ack 1, win 501, options [nop,nop,TS val 3378659573 ecr 804029067], length 268
09:08:37.636219 IP comp3134-winter-2022-intro-to-cyber-security.ssh > cpe64777d6503a3-cm64777d6503a0.sdns.net.rogers.com.51538: Flags [P.], seq 11172:11208, ack 1, win 501, options [nop,nop,TS val 3378659573 ecr 804029067], length 36
09:08:37.641159 IP cpe64777d6503a3-cm64777d6503a0.sdns.net.rogers.com.51538 > comp3134-winter-2022-intro-to-cyber-security.ssh: Flags [.], ack 6968, win 514, options [nop,nop,TS val 804029072 ecr 3378659556], length 0
09:08:37.641231 IP comp3134-winter-2022-intro-to-cyber-security.ssh > cpe64777d6503a3-cm64777d6503a0.sdns.net.rogers.com.51538: Flags [P.], seq 11208:13944, ack 1, win 501, options [nop,nop,TS val 3378659578 ecr 804029072], length 2736
09:08:37.641390 IP comp3134-winter-2022-intro-to-cyber-security.ssh > cpe64777d6503a3-cm64777d6503a0.sdns.net.rogers.com.51538: Flags [P.], seq 13944:14196, ack 1, win 501, options [nop,nop,TS val 3378659578 ecr 804029072], length 252
09:08:37.641446 IP comp3134-winter-2022-intro-to-cyber-security.ssh > cpe64777d6503a3-cm64777d6503a0.sdns.net.rogers.com.51538: Flags [P.], seq 14196:14232, ack 1, win 501, options [nop,nop,TS val 3378659578 ecr 804029072], length 36
09:08:37.641511 IP comp3134-winter-2022-intro-to-cyber-security.ssh > cpe64777d6503a3-cm64777d6503a0.sdns.net.rogers.com.51538: Flags [P.], seq 14232:14508, ack 1, win 501, options [nop,nop,TS val 3378659578 ecr 804029072], length 276
09:08:37.641575 IP comp3134-winter-2022-intro-to-cyber-security.ssh > cpe64777d6503a3-cm64777d6503a0.sdns.net.rogers.com.51538: Flags [P.], seq 14508:14544, ack 1, win 501, options [nop,nop,TS val 3378659579 ecr 804029072], length 36
09:08:37.641639 IP comp3134-winter-2022-intro-to-cyber-security.ssh > cpe64777d6503a3-cm64777d6503a0.sdns.net.rogers.com.51538: Flags [P.], seq 14544:14812, ack 1, win 501, options [nop,nop,TS val 3378659579 ecr 804029072], length 268
09:08:37.641686 IP comp3134-winter-2022-intro-to-cyber-security.ssh > cpe64777d6503a3-cm64777d6503a0.sdns.net.rogers.com.51538: Flags [P.], seq 14812:14848, ack 1, win 501, options [nop,nop,TS val 3378659579 ecr 804029072], length 36
09:08:37.641789 IP comp3134-winter-2022-intro-to-cyber-security.ssh > cpe64777d6503a3-cm64777d6503a0.sdns.net.rogers.com.51538: Flags [P.], seq 14848:15116, ack 1, win 501, options [nop,nop,TS val 3378659579 ecr 804029072], length 268
09:08:37.641847 IP comp3134-winter-2022-intro-to-cyber-security.ssh > cpe64777d6503a3-cm64777d6503a0.sdns.net.rogers.com.51538: Flags [P.], seq 15116:15152, ack 1, win 501, options [nop,nop,TS val 3378659579 ecr 804029072], length 36
09:08:37.641913 IP comp3134-winter-2022-intro-to-cyber-security.ssh > cpe64777d6503a3-cm64777d6503a0.sdns.net.rogers.com.51538: Flags [P.], seq 15152:15420, ack 1, win 501, options [nop,nop,TS val 3378659579 ecr 804029072], length 268
09:08:37.641962 IP comp3134-winter-2022-intro-to-cyber-security.ssh > cpe64777d6503a3-cm64777d6503a0.sdns.net.rogers.com.51538: Flags [P.], seq 15420:15456, ack 1, win 501, options [nop,nop,TS val 3378659579 ecr 804029072], length 36
09:08:37.642025 IP comp3134-winter-2022-intro-to-cyber-security.ssh > cpe64777d6503a3-cm64777d6503a0.sdns.net.rogers.com.51538: Flags [P.], seq 15456:15724, ack 1, win 501, options [nop,nop,TS val 3378659579 ecr 804029072], length 268
09:08:37.642075 IP comp3134-winter-2022-intro-to-cyber-security.ssh > cpe64777d6503a3-cm64777d6503a0.sdns.net.rogers.com.51538: Flags [P.], seq 15724:15760, ack 1, win 501, options [nop,nop,TS val 3378659579 ecr 804029072], length 36
09:08:37.642170 IP comp3134-winter-2022-intro-to-cyber-security.ssh > cpe64777d6503a3-cm64777d6503a0.sdns.net.rogers.com.51538: Flags [P.], seq 15760:16028, ack 1, win 501, options [nop,nop,TS val 3378659579 ecr 804029072], length 268
09:08:37.642251 IP comp3134-winter-2022-intro-to-cyber-security.ssh > cpe64777d6503a3-cm64777d6503a0.sdns.net.rogers.com.51538: Flags [P.], seq 16028:16064, ack 1, win 501, options [nop,nop,TS val 3378659579 ecr 804029072], length 36
09:08:37.642349 IP comp3134-winter-2022-intro-to-cyber-security.ssh > cpe64777d6503a3-cm64777d6503a0.sdns.net.rogers.com.51538: Flags [P.], seq 16064:16332, ack 1, win 501, options [nop,nop,TS val 3378659579 ecr 804029072], length 268
09:08:37.642446 IP comp3134-winter-2022-intro-to-cyber-security.ssh > cpe64777d6503a3-cm64777d6503a0.sdns.net.rogers.com.51538: Flags [P.], seq 16332:16368, ack 1, win 501, options [nop,nop,TS val 3378659579 ecr 804029072], length 36
09:08:37.642539 IP comp3134-winter-2022-intro-to-cyber-security.ssh > cpe64777d6503a3-cm64777d6503a0.sdns.net.rogers.com.51538: Flags [P.], seq 16368:16636, ack 1, win 501, options [nop,nop,TS val 3378659579 ecr 804029072], length 268
09:08:37.642610 IP comp3134-winter-2022-intro-to-cyber-security.ssh > cpe64777d6503a3-cm64777d6503a0.sdns.net.rogers.com.51538: Flags [P.], seq 16636:16672, ack 1, win 501, options [nop,nop,TS val 3378659580 ecr 804029072], length 36
09:08:37.642676 IP comp3134-winter-2022-intro-to-cyber-security.ssh > cpe64777d6503a3-cm64777d6503a0.sdns.net.rogers.com.51538: Flags [P.], seq 16672:16940, ack 1, win 501, options [nop,nop,TS val 3378659580 ecr 804029072], length 268
09:08:37.642736 IP comp3134-winter-2022-intro-to-cyber-security.ssh > cpe64777d6503a3-cm64777d6503a0.sdns.net.rogers.com.51538: Flags [P.], seq 16940:16976, ack 1, win 501, options [nop,nop,TS val 3378659580 ecr 804029072], length 36
09:08:37.642792 IP comp3134-winter-2022-intro-to-cyber-security.ssh > cpe64777d6503a3-cm64777d6503a0.sdns.net.rogers.com.51538: Flags [P.], seq 16976:17244, ack 1, win 501, options [nop,nop,TS val 3378659580 ecr 804029072], length 268
09:08:37.642833 IP comp3134-winter-2022-intro-to-cyber-security.ssh > cpe64777d6503a3-cm64777d6503a0.sdns.net.rogers.com.51538: Flags [P.], seq 17244:17280, ack 1, win 501, options [nop,nop,TS val 3378659580 ecr 804029072], length 36
09:08:37.650532 IP cpe64777d6503a3-cm64777d6503a0.sdns.net.rogers.com.51538 > comp3134-winter-2022-intro-to-cyber-security.ssh: Flags [.], ack 11208, win 512, options [nop,nop,TS val 804029088 ecr 3378659573], length 0
09:08:37.650602 IP comp3134-winter-2022-intro-to-cyber-security.ssh > cpe64777d6503a3-cm64777d6503a0.sdns.net.rogers.com.51538: Flags [P.], seq 17280:20176, ack 1, win 501, options [nop,nop,TS val 3378659588 ecr 804029088], length 2896
09:08:37.650622 IP comp3134-winter-2022-intro-to-cyber-security.ssh > cpe64777d6503a3-cm64777d6503a0.sdns.net.rogers.com.51538: Flags [P.], seq 20176:21232, ack 1, win 501, options [nop,nop,TS val 3378659588 ecr 804029088], length 1056
09:08:37.650771 IP comp3134-winter-2022-intro-to-cyber-security.ssh > cpe64777d6503a3-cm64777d6503a0.sdns.net.rogers.com.51538: Flags [P.], seq 21232:21484, ack 1, win 501, options [nop,nop,TS val 3378659588 ecr 804029088], length 252
09:08:37.650827 IP comp3134-winter-2022-intro-to-cyber-security.ssh > cpe64777d6503a3-cm64777d6503a0.sdns.net.rogers.com.51538: Flags [P.], seq 21484:21520, ack 1, win 501, options [nop,nop,TS val 3378659588 ecr 804029088], length 36
09:08:37.650889 IP comp3134-winter-2022-intro-to-cyber-security.ssh > cpe64777d6503a3-cm64777d6503a0.sdns.net.rogers.com.51538: Flags [P.], seq 21520:21796, ack 1, win 501, options [nop,nop,TS val 3378659588 ecr 804029088], length 276
09:08:37.650935 IP comp3134-winter-2022-intro-to-cyber-security.ssh > cpe64777d6503a3-cm64777d6503a0.sdns.net.rogers.com.51538: Flags [P.], seq 21796:21832, ack 1, win 501, options [nop,nop,TS val 3378659588 ecr 804029088], length 36
09:08:37.650990 IP comp3134-winter-2022-intro-to-cyber-security.ssh > cpe64777d6503a3-cm64777d6503a0.sdns.net.rogers.com.51538: Flags [P.], seq 21832:22108, ack 1, win 501, options [nop,nop,TS val 3378659588 ecr 804029088], length 276
09:08:37.651032 IP comp3134-winter-2022-intro-to-cyber-security.ssh > cpe64777d6503a3-cm64777d6503a0.sdns.net.rogers.com.51538: Flags [P.], seq 22108:22144, ack 1, win 501, options [nop,nop,TS val 3378659588 ecr 804029088], length 36
09:08:37.651091 IP comp3134-winter-2022-intro-to-cyber-security.ssh > cpe64777d6503a3-cm64777d6503a0.sdns.net.rogers.com.51538: Flags [P.], seq 22144:22412, ack 1, win 501, options [nop,nop,TS val 3378659588 ecr 804029088], length 268
09:08:37.651134 IP comp3134-winter-2022-intro-to-cyber-security.ssh > cpe64777d6503a3-cm64777d6503a0.sdns.net.rogers.com.51538: Flags [P.], seq 22412:22448, ack 1, win 501, options [nop,nop,TS val 3378659588 ecr 804029088], length 36
09:08:37.651206 IP comp3134-winter-2022-intro-to-cyber-security.ssh > cpe64777d6503a3-cm64777d6503a0.sdns.net.rogers.com.51538: Flags [P.], seq 22448:22716, ack 1, win 501, options [nop,nop,TS val 3378659588 ecr 804029088], length 268
09:08:37.651280 IP comp3134-winter-2022-intro-to-cyber-security.ssh > cpe64777d6503a3-cm64777d6503a0.sdns.net.rogers.com.51538: Flags [P.], seq 22716:22752, ack 1, win 501, options [nop,nop,TS val 3378659588 ecr 804029088], length 36
09:08:37.651348 IP comp3134-winter-2022-intro-to-cyber-security.ssh > cpe64777d6503a3-cm64777d6503a0.sdns.net.rogers.com.51538: Flags [P.], seq 22752:23020, ack 1, win 501, options [nop,nop,TS val 3378659588 ecr 804029088], length 268
09:08:37.651394 IP comp3134-winter-2022-intro-to-cyber-security.ssh > cpe64777d6503a3-cm64777d6503a0.sdns.net.rogers.com.51538: Flags [P.], seq 23020:23056, ack 1, win 501, options [nop,nop,TS val 3378659588 ecr 804029088], length 36
09:08:37.651446 IP comp3134-winter-2022-intro-to-cyber-security.ssh > cpe64777d6503a3-cm64777d6503a0.sdns.net.rogers.com.51538: Flags [P.], seq 23056:23324, ack 1, win 501, options [nop,nop,TS val 3378659588 ecr 804029088], length 268
09:08:37.651489 IP comp3134-winter-2022-intro-to-cyber-security.ssh > cpe64777d6503a3-cm64777d6503a0.sdns.net.rogers.com.51538: Flags [P.], seq 23324:23360, ack 1, win 501, options [nop,nop,TS val 3378659588 ecr 804029088], length 36
09:08:37.651543 IP comp3134-winter-2022-intro-to-cyber-security.ssh > cpe64777d6503a3-cm64777d6503a0.sdns.net.rogers.com.51538: Flags [P.], seq 23360:23628, ack 1, win 501, options [nop,nop,TS val 3378659588 ecr 804029088], length 268
09:08:37.651618 IP comp3134-winter-2022-intro-to-cyber-security.ssh > cpe64777d6503a3-cm64777d6503a0.sdns.net.rogers.com.51538: Flags [P.], seq 23628:23664, ack 1, win 501, options [nop,nop,TS val 3378659589 ecr 804029088], length 36
09:08:37.651698 IP comp3134-winter-2022-intro-to-cyber-security.ssh > cpe64777d6503a3-cm64777d6503a0.sdns.net.rogers.com.51538: Flags [P.], seq 23664:23932, ack 1, win 501, options [nop,nop,TS val 3378659589 ecr 804029088], length 268
09:08:37.651752 IP comp3134-winter-2022-intro-to-cyber-security.ssh > cpe64777d6503a3-cm64777d6503a0.sdns.net.rogers.com.51538: Flags [P.], seq 23932:23968, ack 1, win 501, options [nop,nop,TS val 3378659589 ecr 804029088], length 36
09:08:37.651809 IP comp3134-winter-2022-intro-to-cyber-security.ssh > cpe64777d6503a3-cm64777d6503a0.sdns.net.rogers.com.51538: Flags [P.], seq 23968:24236, ack 1, win 501, options [nop,nop,TS val 3378659589 ecr 804029088], length 268
09:08:37.651851 IP comp3134-winter-2022-intro-to-cyber-security.ssh > cpe64777d6503a3-cm64777d6503a0.sdns.net.rogers.com.51538: Flags [P.], seq 24236:24272, ack 1, win 501, options [nop,nop,TS val 3378659589 ecr 804029088], length 36
09:08:37.651921 IP comp3134-winter-2022-intro-to-cyber-security.ssh > cpe64777d6503a3-cm64777d6503a0.sdns.net.rogers.com.51538: Flags [P.], seq 24272:24540, ack 1, win 501, options [nop,nop,TS val 3378659589 ecr 804029088], length 268
09:08:37.652003 IP comp3134-winter-2022-intro-to-cyber-security.ssh > cpe64777d6503a3-cm64777d6503a0.sdns.net.rogers.com.51538: Flags [P.], seq 24540:24576, ack 1, win 501, options [nop,nop,TS val 3378659589 ecr 804029088], length 36
09:08:37.652057 IP comp3134-winter-2022-intro-to-cyber-security.ssh > cpe64777d6503a3-cm64777d6503a0.sdns.net.rogers.com.51538: Flags [P.], seq 24576:24844, ack 1, win 501, options [nop,nop,TS val 3378659589 ecr 804029088], length 268
09:08:37.652098 IP comp3134-winter-2022-intro-to-cyber-security.ssh > cpe64777d6503a3-cm64777d6503a0.sdns.net.rogers.com.51538: Flags [P.], seq 24844:24880, ack 1, win 501, options [nop,nop,TS val 3378659589 ecr 804029088], length 36
09:08:37.652154 IP comp3134-winter-2022-intro-to-cyber-security.ssh > cpe64777d6503a3-cm64777d6503a0.sdns.net.rogers.com.51538: Flags [P.], seq 24880:25148, ack 1, win 501, options [nop,nop,TS val 3378659589 ecr 804029088], length 268
09:08:37.652197 IP comp3134-winter-2022-intro-to-cyber-security.ssh > cpe64777d6503a3-cm64777d6503a0.sdns.net.rogers.com.51538: Flags [P.], seq 25148:25184, ack 1, win 501, options [nop,nop,TS val 3378659589 ecr 804029088], length 36
09:08:37.652251 IP comp3134-winter-2022-intro-to-cyber-security.ssh > cpe64777d6503a3-cm64777d6503a0.sdns.net.rogers.com.51538: Flags [P.], seq 25184:25452, ack 1, win 501, options [nop,nop,TS val 3378659589 ecr 804029088], length 268
09:08:37.652294 IP comp3134-winter-2022-intro-to-cyber-security.ssh > cpe64777d6503a3-cm64777d6503a0.sdns.net.rogers.com.51538: Flags [P.], seq 25452:25488, ack 1, win 501, options [nop,nop,TS val 3378659589 ecr 804029088], length 36
09:08:37.652347 IP comp3134-winter-2022-intro-to-cyber-security.ssh > cpe64777d6503a3-cm64777d6503a0.sdns.net.rogers.com.51538: Flags [P.], seq 25488:25756, ack 1, win 501, options [nop,nop,TS val 3378659589 ecr 804029088], length 268
09:08:37.660511 IP cpe64777d6503a3-cm64777d6503a0.sdns.net.rogers.com.51538 > comp3134-winter-2022-intro-to-cyber-security.ssh: Flags [.], ack 16064, win 512, options [nop,nop,TS val 804029094 ecr 3378659579], length 0
09:08:37.660606 IP comp3134-winter-2022-intro-to-cyber-security.ssh > cpe64777d6503a3-cm64777d6503a0.sdns.net.rogers.com.51538: Flags [P.], seq 25756:28652, ack 1, win 501, options [nop,nop,TS val 3378659598 ecr 804029094], length 2896
09:08:37.660635 IP comp3134-winter-2022-intro-to-cyber-security.ssh > cpe64777d6503a3-cm64777d6503a0.sdns.net.rogers.com.51538: Flags [P.], seq 28652:30960, ack 1, win 501, options [nop,nop,TS val 3378659598 ecr 804029094], length 2308
09:08:37.660795 IP comp3134-winter-2022-intro-to-cyber-security.ssh > cpe64777d6503a3-cm64777d6503a0.sdns.net.rogers.com.51538: Flags [P.], seq 30960:31212, ack 1, win 501, options [nop,nop,TS val 3378659598 ecr 804029094], length 252
09:08:37.660856 IP comp3134-winter-2022-intro-to-cyber-security.ssh > cpe64777d6503a3-cm64777d6503a0.sdns.net.rogers.com.51538: Flags [P.], seq 31212:31248, ack 1, win 501, options [nop,nop,TS val 3378659598 ecr 804029094], length 36
09:08:37.660920 IP comp3134-winter-2022-intro-to-cyber-security.ssh > cpe64777d6503a3-cm64777d6503a0.sdns.net.rogers.com.51538: Flags [P.], seq 31248:31524, ack 1, win 501, options [nop,nop,TS val 3378659598 ecr 804029094], length 276
09:08:37.660966 IP comp3134-winter-2022-intro-to-cyber-security.ssh > cpe64777d6503a3-cm64777d6503a0.sdns.net.rogers.com.51538: Flags [P.], seq 31524:31560, ack 1, win 501, options [nop,nop,TS val 3378659598 ecr 804029094], length 36
09:08:37.661022 IP comp3134-winter-2022-intro-to-cyber-security.ssh > cpe64777d6503a3-cm64777d6503a0.sdns.net.rogers.com.51538: Flags [P.], seq 31560:31836, ack 1, win 501, options [nop,nop,TS val 3378659598 ecr 804029094], length 276
09:08:37.661064 IP comp3134-winter-2022-intro-to-cyber-security.ssh > cpe64777d6503a3-cm64777d6503a0.sdns.net.rogers.com.51538: Flags [P.], seq 31836:31872, ack 1, win 501, options [nop,nop,TS val 3378659598 ecr 804029094], length 36
09:08:37.661118 IP comp3134-winter-2022-intro-to-cyber-security.ssh > cpe64777d6503a3-cm64777d6503a0.sdns.net.rogers.com.51538: Flags [P.], seq 31872:32140, ack 1, win 501, options [nop,nop,TS val 3378659598 ecr 804029094], length 268
09:08:37.661161 IP comp3134-winter-2022-intro-to-cyber-security.ssh > cpe64777d6503a3-cm64777d6503a0.sdns.net.rogers.com.51538: Flags [P.], seq 32140:32176, ack 1, win 501, options [nop,nop,TS val 3378659598 ecr 804029094], length 36
09:08:37.661215 IP comp3134-winter-2022-intro-to-cyber-security.ssh > cpe64777d6503a3-cm64777d6503a0.sdns.net.rogers.com.51538: Flags [P.], seq 32176:32444, ack 1, win 501, options [nop,nop,TS val 3378659598 ecr 804029094], length 268
09:08:37.661256 IP comp3134-winter-2022-intro-to-cyber-security.ssh > cpe64777d6503a3-cm64777d6503a0.sdns.net.rogers.com.51538: Flags [P.], seq 32444:32480, ack 1, win 501, options [nop,nop,TS val 3378659598 ecr 804029094], length 36
09:08:37.661320 IP comp3134-winter-2022-intro-to-cyber-security.ssh > cpe64777d6503a3-cm64777d6503a0.sdns.net.rogers.com.51538: Flags [P.], seq 32480:32748, ack 1, win 501, options [nop,nop,TS val 3378659598 ecr 804029094], length 268
09:08:37.661380 IP comp3134-winter-2022-intro-to-cyber-security.ssh > cpe64777d6503a3-cm64777d6503a0.sdns.net.rogers.com.51538: Flags [P.], seq 32748:33024, ack 1, win 501, options [nop,nop,TS val 3378659598 ecr 804029094], length 276
09:08:37.661481 IP comp3134-winter-2022-intro-to-cyber-security.ssh > cpe64777d6503a3-cm64777d6503a0.sdns.net.rogers.com.51538: Flags [P.], seq 33024:34236, ack 1, win 501, options [nop,nop,TS val 3378659598 ecr 804029094], length 1212
09:08:37.661582 IP comp3134-winter-2022-intro-to-cyber-security.ssh > cpe64777d6503a3-cm64777d6503a0.sdns.net.rogers.com.51538: Flags [P.], seq 34236:35216, ack 1, win 501, options [nop,nop,TS val 3378659599 ecr 804029094], length 980
09:08:37.661682 IP comp3134-winter-2022-intro-to-cyber-security.ssh > cpe64777d6503a3-cm64777d6503a0.sdns.net.rogers.com.51538: Flags [P.], seq 35216:35492, ack 1, win 501, options [nop,nop,TS val 3378659599 ecr 804029094], length 276
09:08:37.661791 IP comp3134-winter-2022-intro-to-cyber-security.ssh > cpe64777d6503a3-cm64777d6503a0.sdns.net.rogers.com.51538: Flags [P.], seq 35492:35768, ack 1, win 501, options [nop,nop,TS val 3378659599 ecr 804029094], length 276
09:08:37.661863 IP comp3134-winter-2022-intro-to-cyber-security.ssh > cpe64777d6503a3-cm64777d6503a0.sdns.net.rogers.com.51538: Flags [P.], seq 35768:36044, ack 1, win 501, options [nop,nop,TS val 3378659599 ecr 804029094], length 276
09:08:37.661926 IP comp3134-winter-2022-intro-to-cyber-security.ssh > cpe64777d6503a3-cm64777d6503a0.sdns.net.rogers.com.51538: Flags [P.], seq 36044:36320, ack 1, win 501, options [nop,nop,TS val 3378659599 ecr 804029094], length 276
09:08:37.661992 IP comp3134-winter-2022-intro-to-cyber-security.ssh > cpe64777d6503a3-cm64777d6503a0.sdns.net.rogers.com.51538: Flags [P.], seq 36320:36596, ack 1, win 501, options [nop,nop,TS val 3378659599 ecr 804029094], length 276
09:08:37.662054 IP comp3134-winter-2022-intro-to-cyber-security.ssh > cpe64777d6503a3-cm64777d6503a0.sdns.net.rogers.com.51538: Flags [P.], seq 36596:36872, ack 1, win 501, options [nop,nop,TS val 3378659599 ecr 804029094], length 276
09:08:37.662117 IP comp3134-winter-2022-intro-to-cyber-security.ssh > cpe64777d6503a3-cm64777d6503a0.sdns.net.rogers.com.51538: Flags [P.], seq 36872:37148, ack 1, win 501, options [nop,nop,TS val 3378659599 ecr 804029094], length 276
09:08:37.662183 IP comp3134-winter-2022-intro-to-cyber-security.ssh > cpe64777d6503a3-cm64777d6503a0.sdns.net.rogers.com.51538: Flags [P.], seq 37148:37424, ack 1, win 501, options [nop,nop,TS val 3378659599 ecr 804029094], length 276
09:08:37.662251 IP comp3134-winter-2022-intro-to-cyber-security.ssh > cpe64777d6503a3-cm64777d6503a0.sdns.net.rogers.com.51538: Flags [P.], seq 37424:37700, ack 1, win 501, options [nop,nop,TS val 3378659599 ecr 804029094], length 276
09:08:37.662318 IP comp3134-winter-2022-intro-to-cyber-security.ssh > cpe64777d6503a3-cm64777d6503a0.sdns.net.rogers.com.51538: Flags [P.], seq 37700:37976, ack 1, win 501, options [nop,nop,TS val 3378659599 ecr 804029094], length 276
09:08:37.662402 IP comp3134-winter-2022-intro-to-cyber-security.ssh > cpe64777d6503a3-cm64777d6503a0.sdns.net.rogers.com.51538: Flags [P.], seq 37976:38252, ack 1, win 501, options [nop,nop,TS val 3378659599 ecr 804029094], length 276
09:08:37.662466 IP comp3134-winter-2022-intro-to-cyber-security.ssh > cpe64777d6503a3-cm64777d6503a0.sdns.net.rogers.com.51538: Flags [P.], seq 38252:38528, ack 1, win 501, options [nop,nop,TS val 3378659599 ecr 804029094], length 276
09:08:37.662531 IP comp3134-winter-2022-intro-to-cyber-security.ssh > cpe64777d6503a3-cm64777d6503a0.sdns.net.rogers.com.51538: Flags [P.], seq 38528:38804, ack 1, win 501, options [nop,nop,TS val 3378659599 ecr 804029094], length 276
09:08:37.662600 IP comp3134-winter-2022-intro-to-cyber-security.ssh > cpe64777d6503a3-cm64777d6503a0.sdns.net.rogers.com.51538: Flags [P.], seq 38804:39080, ack 1, win 501, options [nop,nop,TS val 3378659600 ecr 804029094], length 276
09:08:37.666552 IP cpe64777d6503a3-cm64777d6503a0.sdns.net.rogers.com.51538 > comp3134-winter-2022-intro-to-cyber-security.ssh: Flags [.], ack 17280, win 513, options [nop,nop,TS val 804029094 ecr 3378659580], length 0
09:08:37.666622 IP comp3134-winter-2022-intro-to-cyber-security.ssh > cpe64777d6503a3-cm64777d6503a0.sdns.net.rogers.com.51538: Flags [P.], seq 39080:39356, ack 1, win 501, options [nop,nop,TS val 3378659604 ecr 804029094], length 276
09:08:37.666815 IP comp3134-winter-2022-intro-to-cyber-security.ssh > cpe64777d6503a3-cm64777d6503a0.sdns.net.rogers.com.51538: Flags [P.], seq 39356:39848, ack 1, win 501, options [nop,nop,TS val 3378659604 ecr 804029094], length 492
09:08:37.666897 IP comp3134-winter-2022-intro-to-cyber-security.ssh > cpe64777d6503a3-cm64777d6503a0.sdns.net.rogers.com.51538: Flags [P.], seq 39848:40124, ack 1, win 501, options [nop,nop,TS val 3378659604 ecr 804029094], length 276
09:08:37.666967 IP comp3134-winter-2022-intro-to-cyber-security.ssh > cpe64777d6503a3-cm64777d6503a0.sdns.net.rogers.com.51538: Flags [P.], seq 40124:40400, ack 1, win 501, options [nop,nop,TS val 3378659604 ecr 804029094], length 276
09:08:37.667033 IP comp3134-winter-2022-intro-to-cyber-security.ssh > cpe64777d6503a3-cm64777d6503a0.sdns.net.rogers.com.51538: Flags [P.], seq 40400:40676, ack 1, win 501, options [nop,nop,TS val 3378659604 ecr 804029094], length 276
09:08:37.667101 IP comp3134-winter-2022-intro-to-cyber-security.ssh > cpe64777d6503a3-cm64777d6503a0.sdns.net.rogers.com.51538: Flags [P.], seq 40676:40952, ack 1, win 501, options [nop,nop,TS val 3378659604 ecr 804029094], length 276
09:08:37.667165 IP comp3134-winter-2022-intro-to-cyber-security.ssh > cpe64777d6503a3-cm64777d6503a0.sdns.net.rogers.com.51538: Flags [P.], seq 40952:41228, ack 1, win 501, options [nop,nop,TS val 3378659604 ecr 804029094], length 276
09:08:37.667240 IP comp3134-winter-2022-intro-to-cyber-security.ssh > cpe64777d6503a3-cm64777d6503a0.sdns.net.rogers.com.51538: Flags [P.], seq 41228:41504, ack 1, win 501, options [nop,nop,TS val 3378659604 ecr 804029094], length 276
09:08:37.667303 IP comp3134-winter-2022-intro-to-cyber-security.ssh > cpe64777d6503a3-cm64777d6503a0.sdns.net.rogers.com.51538: Flags [P.], seq 41504:41780, ack 1, win 501, options [nop,nop,TS val 3378659604 ecr 804029094], length 276
09:08:37.667367 IP comp3134-winter-2022-intro-to-cyber-security.ssh > cpe64777d6503a3-cm64777d6503a0.sdns.net.rogers.com.51538: Flags [P.], seq 41780:42056, ack 1, win 501, options [nop,nop,TS val 3378659604 ecr 804029094], length 276
09:08:37.667433 IP comp3134-winter-2022-intro-to-cyber-security.ssh > cpe64777d6503a3-cm64777d6503a0.sdns.net.rogers.com.51538: Flags [P.], seq 42056:42332, ack 1, win 501, options [nop,nop,TS val 3378659604 ecr 804029094], length 276
09:08:37.667496 IP comp3134-winter-2022-intro-to-cyber-security.ssh > cpe64777d6503a3-cm64777d6503a0.sdns.net.rogers.com.51538: Flags [P.], seq 42332:42608, ack 1, win 501, options [nop,nop,TS val 3378659604 ecr 804029094], length 276
09:08:37.667560 IP comp3134-winter-2022-intro-to-cyber-security.ssh > cpe64777d6503a3-cm64777d6503a0.sdns.net.rogers.com.51538: Flags [P.], seq 42608:42884, ack 1, win 501, options [nop,nop,TS val 3378659604 ecr 804029094], length 276
09:08:37.667622 IP comp3134-winter-2022-intro-to-cyber-security.ssh > cpe64777d6503a3-cm64777d6503a0.sdns.net.rogers.com.51538: Flags [P.], seq 42884:43160, ack 1, win 501, options [nop,nop,TS val 3378659605 ecr 804029094], length 276
09:08:37.667686 IP comp3134-winter-2022-intro-to-cyber-security.ssh > cpe64777d6503a3-cm64777d6503a0.sdns.net.rogers.com.51538: Flags [P.], seq 43160:43436, ack 1, win 501, options [nop,nop,TS val 3378659605 ecr 804029094], length 276
09:08:37.667754 IP comp3134-winter-2022-intro-to-cyber-security.ssh > cpe64777d6503a3-cm64777d6503a0.sdns.net.rogers.com.51538: Flags [P.], seq 43436:43712, ack 1, win 501, options [nop,nop,TS val 3378659605 ecr 804029094], length 276
09:08:37.672914 IP cpe64777d6503a3-cm64777d6503a0.sdns.net.rogers.com.51538 > comp3134-winter-2022-intro-to-cyber-security.ssh: Flags [.], ack 23932, win 512, options [nop,nop,TS val 804029103 ecr 3378659589], length 0
09:08:37.672914 IP cpe64777d6503a3-cm64777d6503a0.sdns.net.rogers.com.51538 > comp3134-winter-2022-intro-to-cyber-security.ssh: Flags [.], ack 25756, win 511, options [nop,nop,TS val 804029104 ecr 3378659589], length 0
09:08:37.672979 IP comp3134-winter-2022-intro-to-cyber-security.ssh > cpe64777d6503a3-cm64777d6503a0.sdns.net.rogers.com.51538: Flags [P.], seq 43712:43988, ack 1, win 501, options [nop,nop,TS val 3378659610 ecr 804029103], length 276
09:08:37.673174 IP comp3134-winter-2022-intro-to-cyber-security.ssh > cpe64777d6503a3-cm64777d6503a0.sdns.net.rogers.com.51538: Flags [P.], seq 43988:44704, ack 1, win 501, options [nop,nop,TS val 3378659610 ecr 804029104], length 716
09:08:37.673266 IP comp3134-winter-2022-intro-to-cyber-security.ssh > cpe64777d6503a3-cm64777d6503a0.sdns.net.rogers.com.51538: Flags [P.], seq 44704:44980, ack 1, win 501, options [nop,nop,TS val 3378659610 ecr 804029104], length 276
09:08:37.673345 IP comp3134-winter-2022-intro-to-cyber-security.ssh > cpe64777d6503a3-cm64777d6503a0.sdns.net.rogers.com.51538: Flags [P.], seq 44980:45256, ack 1, win 501, options [nop,nop,TS val 3378659610 ecr 804029104], length 276
09:08:37.673428 IP comp3134-winter-2022-intro-to-cyber-security.ssh > cpe64777d6503a3-cm64777d6503a0.sdns.net.rogers.com.51538: Flags [P.], seq 45256:45532, ack 1, win 501, options [nop,nop,TS val 3378659610 ecr 804029104], length 276
09:08:37.673516 IP comp3134-winter-2022-intro-to-cyber-security.ssh > cpe64777d6503a3-cm64777d6503a0.sdns.net.rogers.com.51538: Flags [P.], seq 45532:45808, ack 1, win 501, options [nop,nop,TS val 3378659610 ecr 804029104], length 276
09:08:37.673597 IP comp3134-winter-2022-intro-to-cyber-security.ssh > cpe64777d6503a3-cm64777d6503a0.sdns.net.rogers.com.51538: Flags [P.], seq 45808:46084, ack 1, win 501, options [nop,nop,TS val 3378659611 ecr 804029104], length 276
09:08:37.673671 IP comp3134-winter-2022-intro-to-cyber-security.ssh > cpe64777d6503a3-cm64777d6503a0.sdns.net.rogers.com.51538: Flags [P.], seq 46084:46360, ack 1, win 501, options [nop,nop,TS val 3378659611 ecr 804029104], length 276
09:08:37.673744 IP comp3134-winter-2022-intro-to-cyber-security.ssh > cpe64777d6503a3-cm64777d6503a0.sdns.net.rogers.com.51538: Flags [P.], seq 46360:46636, ack 1, win 501, options [nop,nop,TS val 3378659611 ecr 804029104], length 276
09:08:37.673822 IP comp3134-winter-2022-intro-to-cyber-security.ssh > cpe64777d6503a3-cm64777d6503a0.sdns.net.rogers.com.51538: Flags [P.], seq 46636:46912, ack 1, win 501, options [nop,nop,TS val 3378659611 ecr 804029104], length 276
09:08:37.673899 IP comp3134-winter-2022-intro-to-cyber-security.ssh > cpe64777d6503a3-cm64777d6503a0.sdns.net.rogers.com.51538: Flags [P.], seq 46912:47188, ack 1, win 501, options [nop,nop,TS val 3378659611 ecr 804029104], length 276
09:08:37.673974 IP comp3134-winter-2022-intro-to-cyber-security.ssh > cpe64777d6503a3-cm64777d6503a0.sdns.net.rogers.com.51538: Flags [P.], seq 47188:47464, ack 1, win 501, options [nop,nop,TS val 3378659611 ecr 804029104], length 276
09:08:37.674048 IP comp3134-winter-2022-intro-to-cyber-security.ssh > cpe64777d6503a3-cm64777d6503a0.sdns.net.rogers.com.51538: Flags [P.], seq 47464:47740, ack 1, win 501, options [nop,nop,TS val 3378659611 ecr 804029104], length 276
09:08:37.674142 IP comp3134-winter-2022-intro-to-cyber-security.ssh > cpe64777d6503a3-cm64777d6503a0.sdns.net.rogers.com.51538: Flags [P.], seq 47740:48016, ack 1, win 501, options [nop,nop,TS val 3378659611 ecr 804029104], length 276
09:08:37.674264 IP comp3134-winter-2022-intro-to-cyber-security.ssh > cpe64777d6503a3-cm64777d6503a0.sdns.net.rogers.com.51538: Flags [P.], seq 48016:48292, ack 1, win 501, options [nop,nop,TS val 3378659611 ecr 804029104], length 276
09:08:37.674412 IP comp3134-winter-2022-intro-to-cyber-security.ssh > cpe64777d6503a3-cm64777d6503a0.sdns.net.rogers.com.51538: Flags [P.], seq 48292:48568, ack 1, win 501, options [nop,nop,TS val 3378659611 ecr 804029104], length 276
09:08:37.674518 IP comp3134-winter-2022-intro-to-cyber-security.ssh > cpe64777d6503a3-cm64777d6503a0.sdns.net.rogers.com.51538: Flags [P.], seq 48568:48844, ack 1, win 501, options [nop,nop,TS val 3378659611 ecr 804029104], length 276
09:08:37.674658 IP comp3134-winter-2022-intro-to-cyber-security.ssh > cpe64777d6503a3-cm64777d6503a0.sdns.net.rogers.com.51538: Flags [P.], seq 48844:49120, ack 1, win 501, options [nop,nop,TS val 3378659612 ecr 804029104], length 276
09:08:37.674794 IP comp3134-winter-2022-intro-to-cyber-security.ssh > cpe64777d6503a3-cm64777d6503a0.sdns.net.rogers.com.51538: Flags [P.], seq 49120:49396, ack 1, win 501, options [nop,nop,TS val 3378659612 ecr 804029104], length 276
